raw,new,score
Cao đẳng giao thông vận tải trung ương 2,cao dang giao thong van tai trung uong 2,80
cdssnd 2, cao dang ssnd 2,67
International America University,international america university,91
trường trung cấp nghề Nhân Đạo,trung cap nghe nhan dao,64
Trường dạy nghề thanh xuân,day nghe thanh xuan,71
Đại học Hùng Vương,dai hoc hung vuong,56
Thpt Lương Văn Can,thpt luong van can,61
cao đẳng nghề bách khoa hà nội,cao dang nghe bach khoa ha noi,80
Đại học giao thông vận tải Hà Nội,dai hoc giao thong van tai ha noi,70
HCMUT-FHNW,hcmut fhnw,0
Open University ,open university,84
Học viện Nông Nghiệp Việt Nam,hoc vien nong nghiep viet nam,66
Đại học Tôn Đức Thắng,dai hoc ton duc thang,57
trường cao đẳng kt cao thắng,cao dang kt cao thang,73
Trường Đại Học Sư phạm- Đại học Đà Nẵng,dai hoc su pham  dai hoc da nang,48
VATC,vatc,0
KeyFrame,keyframe,75
KeyFrame,keyframe,75
Kaizen Yoshida School,kaizen yoshida school,86
Đại học Điện Lực,dai hoc dien luc,56
Cao đẳng Kinh tế Đối ngoại,cao dang kinh te doi ngoai,69
Đại học Sư phạm Tp HCM,dai hoc su pham  hcm,52
tốt nghiệp thpt,tot nghiep thpt,87
hướng nghiệp Á Âu,huong nghiep a au,71
đại học công nghiệp hà nội,dai hoc cong nghiep ha noi,73
cao đẳng cơ khí luyện kim,cao dang co khi luyen kim,80
đại hoc kĩ thuật công nghiệp nam định,dai hoc ki thuat cong nghiep nam dinh,78
Trung cấp nghề Hướng nghiệp Á Âu,trung cap nghe huong nghiep a au,72
Trường Đại học Hoa Sen,dai hoc hoa sen,54
Trường Đại Học Hoa Sen,dai hoc hoa sen,49
Học viện Hành chính Quốc gia,hoc vien hanh chinh quoc gia,71
đại học công nghệ tp hcm,dai hoc cong nghe  hcm,74
hung phu,hung phu,100
trung cấp ánh sáng,trung cap anh sang,83
Đại Học Cần Thơ,dai hoc can tho,47
Đại Học Hồng Bàng,dai hoc hong bang,53
cao đẳng y tế khánh hòa,cao dang y te khanh hoa,78
Cao Đẳng nghề,cao dang nghe,69
đại học quốc gia hà nội,dai hoc quoc gia ha noi,74
Đại học Mở tp.hcm,dai hoc mo  hcm,56
sai gon,sai gon,100
đại học Sài Gòn,dai hoc sai gon,53
đh y dược tp hcm, dai hoc  y duoc  hcm,59
Đại học công nghiệp HN,dai hoc cong nghiep ha noi,62
thpt trà cú trà vinh,thpt tra cu tra vinh,85
Đại học Công nghệ TP Hồ Chí Minh,dai hoc cong nghe  hcm,54
Đại học Công Nghiệp TPHCM,dai hoc cong nghiep hcm,54
Đai Hoc An Giang,dai hoc an giang,75
Đại học Cần Thơ,dai hoc can tho,53
trường trung học cơ sở kiên bình,trung hoc co so kien binh,70
đại học giao thông vận tải tphcm,dai hoc giao thong van tai hcm,77
đại học tài chính MARKETING,dai hoc tai chinh marketing,48
Đại học Sư phạm Hà Nội,dai hoc su pham ha noi,55
Đại học Thăng Long,dai hoc thang long,67
Đại học Công nghiệp Hà Nội,dai hoc cong nghiep ha noi,62
đai hoc hoa sen,dai hoc hoa sen,93
Cao Đẳng du lịch hà nội,cao dang du lich ha noi,74
trung học cơ sở ngọc đông,trung hoc co so ngoc dong,76
giao thong van tai trung uong3toot,giao thong van tai trung uong3toot,100
DH NÔNG LÂM TPHCM, dai hoc  nong lam hcm,15
Đại học Kinh Tế TP.HCM,dai hoc kinh te  hcm,48
ĐH Ngân Hàng TPHCM, dai hoc  ngan hang hcm,34
ĐH Công Nghệ Sài Gòn, dai hoc  cong nghe sai gon,43
truong cao dang nghe so 7,cao dang nghe so 7,84
truong cao dang nghe so 7,cao dang nghe so 7,84
trường thpt duy tân,thpt duy tan,71
Đại học Khoa học Xã hội và Nhân văn,dai hoc khoa hoc xa hoi nhan van,63
đại học kiến trúc đà nẵng,dai hoc kien truc da nang,68
Học viện hàng không việt nam,hoc vien hang khong viet nam,79
Đại học tài chính marketing,dai hoc tai chinh marketing,81
Đại học Kinh Tế Luật,dai hoc kinh te luat,60
cao đẳng công nghệ thông tin,cao dang cong nghe thong tin,82
THPT Nguyễn Trãi,thpt nguyen trai,50
Ho Chi Minh City Industrial And Trade College,hcm city industrial and trade college,73
Đại học Khoa học Xã hội & Nhân văn,dai hoc khoa hoc xa hoi   nhan van,65
trường Làng,lang,27
cu chi,cu chi,100
cao đẳng nghề tây ninh,cao dang nghe tay ninh,82
Đại học HUFLIT,dai hoc huflit,36
đại hoc công nghệ sài  gòn,dai hoc cong nghe sai gon,75
Đại học Đà Nẵng,dai hoc da nang,53
Cao đẳng kinh tế tphcm,cao dang kinh te hcm,76
Đại học Tôn Đức Thắng TpHCM,dai hoc ton duc thang hcm,50
Trường dh Nội Vụ Hà Nội, dai hoc  noi vu ha noi,39
Van Lang University,van lang university,84
đại học Luật Hà Nội,dai hoc luat ha noi,53
Trường đại học Sư phạm Tphcm,dai hoc su pham hcm,55
Đại học Cần Thơ,dai hoc can tho,53
Đại học Nguyễn Tất Thành,dai hoc nguyen tat thanh,62
Đại Học Luật TP HCM ,dai hoc luat  hcm,43
Đại học khoa học tự nhiên ,dai hoc khoa hoc tu nhien,75
khoa hoc xa hoi va nhan van,khoa hoc xa hoi nhan van,94
Trường cao đẳng nghề kỹ thuật công nghệ tphcm,cao dang nghe ky thuat cong nghe hcm,72
đại học công nghiệp thực phẩm tp hồ chí minh,dai hoc cong nghiep thuc pham  hcm,68
thpt phan ngoc hien,thpt phan ngoc hien,100
cao đẳng kinh tế đối ngoại,cao dang kinh te doi ngoai,77
truong THPT DUC HANH,thpt duc hanh,18
Đại học Sư Phạm TP.HCM,dai hoc su pham  hcm,43
Trường Cao Đẳng Du Lịch Hà Nội,cao dang du lich ha noi,49
thủy lợi,thuy loi,75
Đại học Cần Thơ,dai hoc can tho,61
cao đẳng thương mại du lich,cao dang thuong mai du lich,81
ngô thời nhiệm,ngo thoi nhiem,79
ĐHXD MIỀN TÂY, dai hoc xd mien tay,12
trung cấp nghề việt giao,trung cap nghe viet giao,88
cao đẳng y tế tiền giang,cao dang y te tien giang,83
Đại học Kinh tế TP. HCM,dai hoc kinh te   hcm,55
cao đẳng kỹ thuật công nghệ Quy Nhơn,cao dang ky thuat cong nghe quy nhon,75
trường cao đẳng sư phạm lạng sơn,cao dang su pham lang son,67
cao đẳng du lịch sài gòn,cao dang du lich sai gon,79
Trường Đại học Thuỷ Lợi,dai hoc thuy loi,46
Trung cấp kỹ thuật công nghiệp đồng nai,trung cap ky thuat cong nghiep dong nai,79
Đại học kinh tế TPHCM,dai hoc kinh te hcm,60
FPT Arena,fpt arena,56
CĐ Tài chính Hải quan, cao dang  tai chinh hai quan,56
trung hoc co so le van huu,trung hoc co so le van huu,100
Đh Công Nghệ Tp.HCM, dai hoc  cong nghe  hcm,37
đại học vinh,dai hoc vinh,75
Đại Học Sư phạm Thái Nguyên,dai hoc su pham thai nguyen,59
ĐH CÔNG NGHIỆP THỰC PHẨM TPHCM, dai hoc  cong nghiep thuc pham hcm,15
tốt nghiệp trung học,tot nghiep trung hoc,85
Van Lang University,van lang university,84
Đh Mở tphcm, dai hoc  mo hcm,43
TCTH ĐÔNG NAN Á,tcth dong nan a,20
Trường đại học công nghệ thông tin tphcm,dai hoc cong nghe thong tin hcm,70
Đại học Tài Chính Marketing,dai hoc tai chinh marketing,70
Cao Đẳng Công Nghệ Và Thương Mại Hà Nội,cao dang cong nghe thuong mai ha noi,53
truong  trung học chiêng phung,trung hoc chieng phung,77
Foreign Trade University,foreign trade university,88
truong cao dang son la,cao dang son la,81
Cao đẳng Văn hóa Nghệ thuật TpHCM,cao dang van hoa nghe thuat hcm,59
lý tự trọng,ly tu trong,73
truong giong ong to,giong ong to,77
Đại học công nghiệp hà nội,dai hoc cong nghiep ha noi,73
GDTX Phú Nhuận, gia duc thuong xuyen  phu nhuan,26
Chaopraya University,chaopraya university,90
Cao đẳng Kinh tế - Kỹ thuật Cần Thơ,cao dang kinh te   ky thuat can tho,63
trường đại học kinh doanh công nghệ hà nội,dai hoc kinh doanh cong nghe ha noi,73
đh tài chính marketing, dai hoc  tai chinh marketing,75
trung hoc co so,trung hoc co so,100
Đại học sư phạm,dai hoc su pham,67
infowordschool,infowordschool,100
Cao đẳng kỹ thuật Lý Tự Trọng,cao dang ky thuat ly tu trong,62
Đại học Công nghiệp Thực phẩm TP. HCM,dai hoc cong nghiep thuc pham   hcm,61
Đại học Bình Dương,dai hoc binh duong,56
Đại học Văn Hiến hcm,dai hoc van hien hcm,65
Đại học Công nghiệp Thực phẩm thành phố Hồ Chí Minh,dai hoc cong nghiep thuc pham   hcm,56
trường Trung cấp kỹ thuật hải quân,trung cap ky thuat hai quan,72
Đại học Quốc tế Hồng Bàng,dai hoc quoc te hong bang,60
công nghệ giao thông vận tải,cong nghe giao thong van tai,82
univesity of economic & law,univesity of economic   law,96
Đại Học Mở Tp.Hcm,dai hoc mo  hcm,44
đại học lao động xã hội,dai hoc lao dong xa hoi,70
Đại học kỹ thuật công nghệ TPHCM (HUTECH),dai hoc ky thuat cong nghe hcm ,62
Cao Đẳng Công Thương Hồ Chí Minh,cao dang cong thuong hcm,50
HCM Industry And Trade College,hcm industry and trade college,77
Đại học Kinh tế Quốc dân,dai hoc kinh te quoc dan,67
Công nghệ sài gòn,cong nghe sai gon,71
Đại học Ngoại Ngữ Huế,dai hoc ngoai ngu hue,57
trung hoc co so hoa tan,trung hoc co so hoa tan,100
học viện quân y,hoc vien quan y,80
Đại học Tôn Đức Thắng,dai hoc ton duc thang,57
đại học badch khoa,dai hoc badch khoa,83
Học viện Công nghệ Bưu chính Viễn thông,hoc vien cong nghe buu chinh vien thong,69
tự do,tu do,80
Đại học Công Nghiệp Hà Nội,dai hoc cong nghiep ha noi,58
đại học bách khoa tp hcm,dai hoc bach khoa  hcm,78
nhô gia tự,nho gia tu,80
đại học bách khoa tp Hcm,dai hoc bach khoa  hcm,74
trường trung học cơ sở lê thánh tôn,trung hoc co so le thanh ton,70
Đại Học Đại Nam,dai hoc dai nam,53
Trường Đại học Sư phạm Hà Nội,dai hoc su pham ha noi,47
thpt trần phú,thpt tran phu,85
truong cao đang cong nghiep tuy hoa,cao dang cong nghiep tuy hoa,86
Đại học Văn Hóa Tphcm,dai hoc van hoa hcm,60
lâm hà,lam ha,67
Khoa Dầu khí - Đại học mỏ địa chất Hà Nội,khoa dau khi   dai hoc mo dia chat ha noi,61
Đại Học Ngân Hàng TP.HCM,dai hoc ngan hang  hcm,43
trung cấp kinh tế kỹ thuật sài gòn,trung cap kinh te ky thuat sai gon,82
ha noi open university,ha noi open university,100
truong cao dang kinh te ki thuat vinatex,cao dang kinh te ki thuat vinatex,90
Nam Sai Gon,nam sai gon,73
Đại học Luật Tp.HCM,dai hoc luat  hcm,44
HUTECH - Trường Đại học Công nghệ TP.HCM,hutech   truong dai hoc cong nghe  hcm,46
Đại học BR-VT,dai hoc br vt,50
Đại học Công nghiệp Hà Nội,dai hoc cong nghiep ha noi,62
Đại Học Kinh Doanh và Công Nghệ Hà Nội,dai hoc kinh doanh cong nghe ha noi,58
Đại Học Kinh Doanh và Công Nghệ Hà Nội,dai hoc kinh doanh cong nghe ha noi,58
Đại học Ngân Hàng TPHCM,dai hoc ngan hang hcm,50
Trường Đại Học Vinh,dai hoc vinh,45
Học viện Tài Chính (Academy Of Finance),hoc vien tai chinh ,41
CD Thương Mại Và Du Lịch Hà Nội, cao dang  thuong mai du lich ha noi,42
Tôn Đức Thắng University,ton duc thang university,71
Trường Đại Học Khoa Học Tự Nhiên Thành phố Hồ Chí Minh,dai hoc khoa hoc tu nhien   hcm,42
Dai Hoc Tong Hop TP HCM,dai hoc tong hop  hcm,64
Dai Hoc Tong Hop TP HCM,dai hoc tong hop  hcm,64
THCS KỲ NAM,thcs ky nam,18
Đại Học Kiến trúc Tphcm,dai hoc kien truc hcm,64
THCS Trần Bội Cơ,thcs tran boi co,38
THCS Trần Bội Cơ,thcs tran boi co,38
Cao Đẳng Sư Phạm Tây Ninh,cao dang su pham tay ninh,60
Trường Cao Đẳng Giao Thông Vận Tải III,cao dang giao thong van tai  2 i,51
Đại học Mở TPHCM,dai hoc mo hcm,40
Đại Học kinh tế Thành phố Hồ Chí Minh,dai hoc kinh te   hcm,48
ĐH Thương Mại, dai hoc  thuong mai,36
Đại Học Nguyễn Tất Thành,dai hoc nguyen tat thanh,58
Đại Học Tôn Đức Thắng,dai hoc ton duc thang,52
 STHC - Saigontourist Hospitality College,sthc   saigontourist hospitality college,81
THPT Phú Nhuận,thpt phu nhuan,43
THPT Phú Nhuận,thpt phu nhuan,43
THPT Bán Công Đông Hưng,thpt ban cong dong hung,48
Cao Đẳng Công Nghiệp Quốc Phòng,cao dang cong nghiep quoc phong,65
THPT Bán Công Đông Hưng,thpt ban cong dong hung,48
Cao Đẳng Công Nghiệp Quốc Phòng,cao dang cong nghiep quoc phong,65
Trường Đại học Kinh Tế Quốc Dân,dai hoc kinh te quoc dan,51
Trường trung cấp Kinh Tế - Kỹ Thuật Nguyễn Hữu Cảnh,trung cap kinh te   ky thuat nguyen huu canh,61
Đại học Công Nghệ Thành phố Hồ Chí Minh- HUTECH,dai hoc cong nghe   hcm  hutech,44
Đại học Công Nghệ Thành phố Hồ Chí Minh- HUTECH,dai hoc cong nghe   hcm  hutech,44
Đại học Công nghiệp Thực phẩm Thành phố Hồ Chí Minh,dai hoc cong nghiep thuc pham   hcm,56
trường đại học sư phạm tphcm,dai hoc su pham hcm,60
Đại học GTVT TP HCM,dai hoc giao thong van tai  hcm,28
Trương Vĩnh Ký,vinh ky,29
Đại học Duy Tân,dai hoc duy tan,60
Arena Multimedia,arena multimedia,88
Đại học công nghiệp thực phẩm tphcm,dai hoc cong nghiep thuc pham hcm,76
Trần Hưng Đạo,tran hung dao,54
trai giam cay cay tay ninh,trai giam cay cay tay ninh,100
trường cđ quốc tế lilama 2, cao dang  quoc te lilama 2,68
Đại học thương mại Hà Nội,dai hoc thuong mai ha noi,60
tpht trung nghĩa,ht trung nghia,87
DH Giao thông vận tải - CS2, dai hoc  giao thong van tai   co so 2,55
Trường trung cấp kinh tế kỹ thuật Nguyễn Hữu Cảnh,trung cap kinh te ky thuat nguyen huu canh,70
đại học giao thông vận tải hà nội,dai hoc giao thong van tai ha noi,76
đại học dược hà nội,dai hoc duoc ha noi,63
Đai học Tổng hợp TP.HCM,dai hoc tong hop  hcm,55
trung tâm đào tạo lái xe Lạc Hồng,trung tam dao tao lai xe lac hong,73
viện học mở hà nội,vien hoc mo ha noi,72
trung tâm đào tạo lái xe Lạc Hồng,trung tam dao tao lai xe lac hong,73
thủy lợi,thuy loi,75
Đại học Cần Thơ,dai hoc can tho,53
Đại học Tây Đô,dai hoc tay do,50
Đại Học Duy Tân ,dai hoc duy tan,52
tc nghe ht,tc nghe ht,100
ĐẠI HỌC NHA TRANG,dai hoc nha trang,18
truong trung hoc pho thong phu thanh B,trung hoc pho thong phu thanh b,87
Hutech,hutech,83
trung học cơ sở cộng hòa,trung hoc co so cong hoa,79
Trường Trung Học Cơ Sở Thượng Quan,trung hoc co so thuong quan,52
Trường Trung Học Cơ Sở Thượng Quan,trung hoc co so thuong quan,52
Đại học Giao thông vận tải Phân hiệu TP.HCM,dai hoc giao thong van tai phan hieu  hcm,64
Nông Lâm Thành Phố Hồ Chí Minh,nong lam   hcm,36
Cao Đẳng Kỹ Thuật Cao Thắng,cao dang ky thuat cao thang,63
trường cao đẵng kĩ thuật Cao Thắng,cao dang ki thuat cao thang,66
Đại học Ngoại thương,dai hoc ngoai thuong,65
University of Labour and Social Affairs (ULSA),university of labour and social affairs ,84
Đại học Thủy lợi Hà Nội,dai hoc thuy loi ha noi,57
Đại học văn hoá,dai hoc van hoa,67
cao đẳng Bách Việt,cao dang bach viet,67
Thpt,thpt,75
Trường đại học công nghiệp tphcm,dai hoc cong nghiep hcm,65
lái xe,lai xe,83
Cao Đẳng Công Nghiệp Phúc Yên,cao dang cong nghiep phuc yen,62
Cao Đẳng Kinh tế Công nghệ,cao dang kinh te cong nghe,69
cao đẳng xd số 2,cao dang xd so 2,81
Đại học Công Nghệ Tp hcm,dai hoc cong nghe  hcm,65
đại học mở thành phố Hồ Chí Minh,dai hoc mo   hcm,42
Đại học Tài nguyên và Môi trường Hà Nội,dai hoc tai nguyen moi truong ha noi,59
Đại học Tôn Đức Thắng,dai hoc ton duc thang,57
trung tâm dạy lái xe oto trung chánh q12,trung tam day lai xe oto trung chanh q12,90
Cao đẳng Bách Việt,cao dang bach viet,61
Trung tâm tin học,trung tam tin hoc,82
hoà thắng,hoa thang,78
thpt,thpt,100
đại học giao thông vận tải,dai hoc giao thong van tai,77
phan ngọc hiển,phan ngoc hien,87
trường cao đẳng van hoá nghệ thuật và du lịch sài gòn,cao dang van hoa nghe thuat du lich sai gon,73
Gia Định,gia dinh,62
Đại học Quốc tế Sài Gòn,dai hoc quoc te sai gon,57
Đại học công nghiệp HCM ,dai hoc cong nghiep hcm,64
phương nam,phuong nam,80
Trung cấp kinh tế kĩ thuật đồng nai,trung cap kinh te ki thuat dong nai,80
cao đẳng y tế khánh hoà,cao dang y te khanh hoa,78
ĐH CÔNG NGHỆ TPHCM, dai hoc  cong nghe hcm,15
trung học phổ thông,trung hoc pho thong,84
University of Finance and Marketing,university of finance and marketing,91
Đại học Công nghệ TP.HCM,dai hoc cong nghe  hcm,52
Đại học Duy Tân Đà Nẵng,dai hoc duy tan da nang,57
tài chính marketting,tai chinh marketting,90
đại học cần thơ,dai hoc can tho,67
đại học cần thơ,dai hoc can tho,67
sài gòn tourist,sai gon tourist,87
đại học Cần Thơ,dai hoc can tho,53
đại học quốc gia,dai hoc quoc gia,75
Banking Uni,banking uni,82
Đại học Sư phạm TPHCM,dai hoc su pham hcm,50
Đại học Luật Tp. Hồ Chí Minh,dai hoc luat   hcm,48
DH Cong Nghiep TPHCM, dai hoc  cong nghiep hcm,49
Đại Học Luật TPHCM,dai hoc luat hcm,41
Cao Đẳng Kĩ Thuật Cao Thắng,cao dang ki thuat cao thang,63
CĐ Văn Hoá Nghệ Thuật và Du Lịch Sài Gòn, cao dang  van hoa nghe thuat du lich sai gon,47
Đại Học Hàng Hải Việt Nam,dai hoc hang hai viet nam,65
Đại học Khoa học Xã hội và Nhân văn,dai hoc khoa hoc xa hoi nhan van,63
Trường Đại học Tôn Đức Thắng,dai hoc ton duc thang,49
trường đại học bạc liêu,dai hoc bac lieu,56
Trường Đại Học Nam Cần Thơ,dai hoc nam can tho,44
Đại Học Hoa Sen,dai hoc hoa sen,69
Kinh Tế Quốc Dân,kinh te quoc dan,56
Đại học Quốc Tế - ĐHQG TP.HCM,dai hoc quoc te    dai hoc  quoc gia   hcm,31
Cao đẳng Kinh tế đối ngoại,cao dang kinh te doi ngoai,69
Đại học Bách khoa Đà Nẵng,dai hoc bach khoa da nang,64
Đại học Văn Lang,dai hoc van lang,62
Viện ĐH Mở Hà Nội,vien  dai hoc  mo ha noi,34
Học viện Tư Pháp,hoc vien tu phap,56
Đại học Kinh tế Quốc dân,dai hoc kinh te quoc dan,67
đại học tài chính- marketing,dai hoc tai chinh  marketing,79
Trường cao đẳng kinh tế kỹ thuật công nghiệp hà nội,cao dang kinh te ky thuat cong nghiep ha noi,74
cao đẳng công nghiệp và xây dựng,cao dang cong nghiep xay dung,75
Đại Học Sài Gòn,dai hoc sai gon,47
Đại Học Bách Khoa TP.HCM,dai hoc bach khoa  hcm,48
Đại Học Điện Lực,dai hoc dien luc,50
Đại học Văn Lang,dai hoc van lang,62
Đh Nông lâm tp.hcm, dai hoc  nong lam  hcm,54
đại học nông lâm tp hcm ,dai hoc nong lam  hcm,71
Cao Đẳng Du Lịch Nha Trang,cao dang du lich nha trang,69
Khoa học xã hội và nhân văn tpHCM,khoa hoc xa hoi nhan van hcm,62
học viện Ngân Hàng,hoc vien ngan hang,67
Đại Học Công Nghệ Tp.HCM,dai hoc cong nghe  hcm,43
Khoa học xã hội và Nhân Văn,khoa hoc xa hoi nhan van,63
Trường Đại học Nông Lâm Thành phố Hồ Chí Minh,dai hoc nong lam   hcm,39
đại học công nghiệp hà nội,dai hoc cong nghiep ha noi,73
Cao đẳng Cộng đồng Bình Thuận,cao dang cong dong binh thuan,62
Học viện Ngân Hàng,hoc vien ngan hang,61
Trường Đại học Tài Nguyên và Môi trường TP.Hồ Chí Minh,dai hoc tai nguyen moi truong  hcm,48
Cao Đẳng Tài Chính Hải Quan,cao dang tai chinh hai quan,63
Cao đẳng Kinh tế Đối ngoại,cao dang kinh te doi ngoai,69
Trường Đại học Tài chính - Marketing,dai hoc tai chinh   marketing,65
Đại Học Lao Động-Xã Hội,dai hoc lao dong xa hoi,48
Đại học Công Nghệ - Hutech,dai hoc cong nghe   hutech,65
Yonsei University,yonsei university,88
trung học phổ thông cà mau,trung hoc pho thong ca mau,85
Đại học công nghiệp thực phẩm tphcm,dai hoc cong nghiep thuc pham hcm,76
cao đẳng VHNT VÀ DL SÀI GÒN,cao dang vhnt dl sai gon,39
Trường học viện công nghệ bưu chính viễn thông,hoc vien cong nghe buu chinh vien thong,73
Đại học Khánh Hòa,dai hoc khanh hoa,59
Đại học Tôn Đức Thắng,dai hoc ton duc thang,57
Cao đẳng Kinh tế Đối ngoại,cao dang kinh te doi ngoai,69
Đại học Khoa học Xã hội và Nhân văn,dai hoc khoa hoc xa hoi nhan van,63
đại học kỹ thuật công nghệ TPHCM,dai hoc ky thuat cong nghe hcm,65
Đại Học Bình Dương,dai hoc binh duong,50
cao đẳng sư phạm trung ương,cao dang su pham trung uong,78
học viện hàng không VN,hoc vien hang khong vn,73
Đại học Sư phạm thành phố Hồ Chí Minh,dai hoc su pham   hcm,45
Đại học công nghiệp thực phẩm,dai hoc cong nghiep thuc pham,76
Đại Học Nguyễn Tất Thành,dai hoc nguyen tat thanh,58
Đại học Công nghệ Hồ Chí Minh - HUTECH,dai hoc cong nghe hcm   hutech,47
Diplomatic Academy of VietNam,diplomatic academy of vietnam,86
Đại học Công nghiệp TPHCM - HUI,dai hoc cong nghiep hcm   hui,53
cao đẳng kĩ thuật Cao Thắng,cao dang ki thuat cao thang,74
Trường Đại học Quốc tế -Đại học quốc gia TP.HCM,dai hoc quoc te  dai hoc quoc gia  hcm,54
Nông Lâm,nong lam,50
Trường Đại Học Khoa Học Xã Hội & Nhân Văn TP.HCM,dai hoc khoa hoc xa hoi   nhan van  hcm,44
cao đẳng thương mại,cao dang thuong mai,74
Đại học Văn Lang,dai hoc van lang,62
Inje ,inje,67
Hutech,hutech,83
Đại học nông lâm TPHCM,dai hoc nong lam hcm,57
Đại Học Kinh Tế Luật ,dai hoc kinh te luat,54
Học Viện Tư Pháp ,hoc vien tu phap,48
Đại Học Kinh Tế TPHCM,dai hoc kinh te hcm,45
Đại học Kinh tế TP.HCM,dai hoc kinh te  hcm,52
Đại học Nông Lâm Thành phố Hồ Chí Minh,dai hoc nong lam   hcm,43
Hoa Sen University,hoa sen university,83
Đại học Ngoại ngữ Đà Nẵng,dai hoc ngoai ngu da nang,60
Đại học Ngoại Thương,dai hoc ngoai thuong,60
Đại học Hoa Sen,dai hoc hoa sen,67
Trường Đại Học Ngoại Ngữ - Tin Học Thành phố Hồ Chí Minh,dai hoc ngoai ngu   tin hoc   hcm,43
Đại Học Phan Thiết,dai hoc phan thiet,61
cao đẳng kinh tế công nghệ thành phố hồ chí minh ,cao dang kinh te cong nghe   hcm,67
Đại học Khoa học Xã hội và Nhân văn,dai hoc khoa hoc xa hoi nhan van,63
Đại học Tài chính - Marketing,dai hoc tai chinh   marketing,81
Học viện Báo chí và Tuyên truyền,hoc vien bao chi tuyen truyen,66
Cao đẳng Kinh tế đối ngoại,cao dang kinh te doi ngoai,69
Kolej Universiti Insaniah,kolej universiti insaniah,88
Đại học Bách Khoa Hà Nội,dai hoc bach khoa ha noi,58
Văn Lang,van lang,62
Trường cao đẳng kinh tế đói ngoại,cao dang kinh te doi ngoai,68
Truong Dai Hoc Insaniah,dai hoc insaniah,67
Đại học kinh tế quốc dân,dai hoc kinh te quoc dan,75
saigontourist,saigontourist,100
Khoa học tự nhiên- đại học quốc gia Tp Hồ Chí Minh,khoa hoc tu nhien  dai hoc quoc gia  hcm,64
Cao đẳng kinh tế đối ngoại,cao dang kinh te doi ngoai,73
Đại Học Sài Gòn,dai hoc sai gon,47
Oulu University of Applied Sciences,oulu university of applied sciences,89
Học viện Báo chí và Tuyên truyền,hoc vien bao chi tuyen truyen,66
Cao đẳng Kinh tế Đối ngoại,cao dang kinh te doi ngoai,69
Đại học ngoại ngữ - tin học TPHCM,dai hoc ngoai ngu   tin hoc hcm,66
Đại học Tài chính - Marketing,dai hoc tai chinh   marketing,72
Tôn Đức Thắng,ton duc thang,54
Đại học Nông Lâm TP. Hồ Chí Minh,dai hoc nong lam   hcm,52
đại học kinh doanh và công nghệ hà nội ,dai hoc kinh doanh cong nghe ha noi,76
đại học công nghiệp to hcm,dai hoc cong nghiep to hcm,81
Đại học Tôn Đức Thắng,dai hoc ton duc thang,57
Học Viện Công Nghệ Bưu Chính Viễn Thông,hoc vien cong nghe buu chinh vien thong,59
Trường hướng nghiệp Á-Âu,huong nghiep a au,49
Saigon Tourism Vocational College,saigon tourism vocational college,88
Greenwich University,greenwich university,90
Đại học Công Nghiệp Thành Phố Hồ Chí Minh,dai hoc cong nghiep   hcm,48
Đại học Quy Nhơn,dai hoc quy nhon,62
Trường Đại học Văn Lang,dai hoc van lang,51
trường đại học Kinh Tế Đà Nẵng,dai hoc kinh te da nang,54
CAO ĐẲNG KINH TẾ ĐỐI NGOẠI,cao dang kinh te doi ngoai,19
Đại học Khoa học Xã hội và Nhân văn thành phố Hồ Chí Minh,dai hoc khoa hoc xa hoi nhan van   hcm,53
trường cao đẳng y cà mau,cao dang y ca mau,68
Đại học Công Nghiệp thực phẩm Tphcm,dai hoc cong nghiep thuc pham hcm,71
cao đẳng công nghiệp tuy hòa,cao dang cong nghiep tuy hoa,82
Đại Học HUFLIT,dai hoc huflit,29
Trường ĐH thể dục thể thao Đà Nẵng, dai hoc  the duc the thao da nang,56
Đại học Tôn Đức Thắng,dai hoc ton duc thang,57
Đại học Cần Thơ,dai hoc can tho,53
đại học tài chính maketting,dai hoc tai chinh maketting,81
Đại học Kinh tế Quốc dân,dai hoc kinh te quoc dan,67
Đại Học Quy Nhơn,dai hoc quy nhon,56
Vietnamese-German University,vietnamese german university,86
trường trung cấp đông dương,trung cap dong duong,64
THPT Sương Nguyệt Ánh,thpt suong nguyet anh,52
Đại học Nông Lâm TPHCM,dai hoc nong lam hcm,48
đại học khoa học xã hội và nhân văn,dai hoc khoa hoc xa hoi nhan van,72
