raw,new,score
DHBKHN, dai hoc  bach khoa hn,0
vien dai hoc mo ha noi,vien dai hoc mo ha noi,100
Viện đại học Mở Hà Nội,vien dai hoc mo ha noi,50
Fpt,fpt,67
Dh công nghiệp hà nội, dai hoc  cong nghiep ha noi,65
Dh công nghiệp hà nội, dai hoc  cong nghiep ha noi,65
FPT university,fpt university,79
back khoa aptech,back khoa aptech,100
quản trị doanh nghiệp,quan tri doanh nghiep,86
ĐH Công nghiệp Hà Nội, dai hoc  cong nghiep ha noi,49
đại học y dược Cần Thơ,dai hoc y duoc can tho,59
khoa học quân sự,khoa hoc quan su,81
Đại Học Thương Mại,dai hoc thuong mai,50
đại học văn lang,dai hoc van lang,75
Đại học Ngoại Ngữ ĐHQG HN,dai hoc ngoai ngu  dai hoc  quoc gia  ha noi,35
Đại học Ngoại Ngữ ĐHQG HN,dai hoc ngoai ngu  dai hoc  quoc gia  ha noi,35
Đại Học Kinh Tế Kỹ Thuật Công Nghiệp,dai hoc kinh te ky thuat cong nghiep,58
Đại học Cửu Long,dai hoc cuu long,62
Trung tâm giáo dục thường xuyên đình xuyên,trung tam giao duc thuong xuyen dinh xuyen,76
trung cấp y dược mêkong,trung cap y duoc mekong,83
Cao Đẳng Kinh Tế-Công Nghệ TPHCM,cao dang kinh te cong nghe hcm,52
Trường Cao Đẳng Kinh Tế TPHCM,cao dang kinh te hcm,45
cd kt-kt, cao dang  kt kt,58
Đai học kinh tế kỹ thuật Bình Dương,dai hoc kinh te ky thuat binh duong,71
Đai học kinh tế kỹ thuật Bình Dương,dai hoc kinh te ky thuat binh duong,71
Đai học kinh tế kỹ thuật Bình Dương,dai hoc kinh te ky thuat binh duong,71
Đai học kinh tế kỹ thuật Bình Dương,dai hoc kinh te ky thuat binh duong,71
THPT Thanh Đa,thpt thanh da,54
Nguyễn Tất Thành,nguyen tat thanh,62
Đại học Tài chính - Marketing,dai hoc tai chinh   marketing,72
cao dang tai chinh hai quan,cao dang tai chinh hai quan,100
Đại học tài chính quản trị kinh doanh,dai hoc tai chinh quan tri kinh doanh,81
Đại học Tài chính Marketing,dai hoc tai chinh marketing,74
tc sp mẫu giáo nhà trẻ hn,tc su pham mau giao nha tre ha noi,71
Đại học Thủ Đô,dai hoc thu do,50
điện xi nghiệp,dien xi nghiep,73
thpt Lê thị riêng,thpt le thi rieng,76
Cao đẳng y tế Thanh Hóa,cao dang y te thanh hoa,69
THPT Tây Sơn,thpt tay son,33
THPT Tây Sơn,thpt tay son,33
Đại Học Xây Dựng Miền Tây,dai hoc xay dung mien tay,52
Trường THPT PHAN CHU TRINH,thpt phan chu trinh,13
cao đẳng kỹ thuật nghiệp vụ thủ đũc,cao dang ky thuat nghiep vu thu duc,74
học viện nông nghiệp việt nam,hoc vien nong nghiep viet nam,83
học viện nông nghiệp Việt Nam,hoc vien nong nghiep viet nam,76
dh nông lâm tp hồ chí minh, dai hoc  nong lam  hcm,57
đại học sư phạm tphcm,dai hoc su pham hcm,70
Đại học công đoàn,dai hoc cong doan,65
Cao Đẳng VHNT & DL Nha trang,cao dang vhnt   dl nha trang,61
cao đẳng kỹ thuật cao thắng,cao dang ky thuat cao thang,81
Đại học An Giang,dai hoc an giang,69
cao đẳng cộng đồng,cao dang cong dong,72
cao đẳng cộng đồng,cao dang cong dong,72
cao đẳng cộng đồng,cao dang cong dong,72
cao đẳng cộng đồng,cao dang cong dong,72
cao đẳng cộng đồng,cao dang cong dong,72
cao đẳng sư phạm huế,cao dang su pham hue,75
cao đẳng sư phạm huế,cao dang su pham hue,75
cao đẳng sư phạm huế,cao dang su pham hue,75
cao đẳng sư phạm huế,cao dang su pham hue,75
cao đẳng sư phạm huế,cao dang su pham hue,75
cao đẳng sư phạm huế,cao dang su pham hue,75
cao đẳng sư phạm huế,cao dang su pham hue,75
cao đẳng sư phạm huế,cao dang su pham hue,75
cao đẳng sư phạm huế,cao dang su pham hue,75
cao đẳng sư phạm huế,cao dang su pham hue,75
cao đẳng sư phạm huế,cao dang su pham hue,75
cao đẳng sư phạm huế,cao dang su pham hue,75
Đại học Mở TP.HCM,dai hoc mo  hcm,38
Đại học Mở TP.HCM,dai hoc mo  hcm,38
Đại học Mở TP.HCM,dai hoc mo  hcm,38
Đại học Mở TP.HCM,dai hoc mo  hcm,38
Đại học Hà Nội,dai hoc ha noi,50
đại học Kinh Tế Quốc Dân,dai hoc kinh te quoc dan,58
Đại học Kinh Tế TP.HCM,dai hoc kinh te  hcm,48
Trường Đại Học Cần Thơ,dai hoc can tho,38
Cao Đẳng Kinh Tế Đối Ngoại,cao dang kinh te doi ngoai,62
Học viện nông nghiệp Việt Nam,hoc vien nong nghiep viet nam,72
Đại học CN thành phố HCM,dai hoc cong nghe   hcm,43
Đại học Bách khoa HN,dai hoc bach khoa ha noi,59
ĐẠI HỌC CÔNG NGHỆ SÀI GÒN STU,dai hoc cong nghe sai gon stu,21
Học viện Nông nghiệp Việt Nam,hoc vien nong nghiep viet nam,69
trường đại học kinh tế tài chính,dai hoc kinh te tai chinh,67
Học viện Báo chí và Tuyên truyền,hoc vien bao chi tuyen truyen,69
đại học giao thông vận tải thành phố HCM,dai hoc giao thong van tai   hcm,64
kinh tế quốc dân,kinh te quoc dan,81
trường đại học công nghệ sài gòn,dai hoc cong nghe sai gon,63
học viện nông nghiệp việt nam,hoc vien nong nghiep viet nam,83
ĐH Ngoại Thương, dai hoc  ngoai thuong,43
cao đẵng nông nghiệp Nam Bộ,cao dang nong nghiep nam bo,74
Trường THPT Nguyễn Huệ,thpt nguyen hue,38
Trường DH Nông nghiêp Hà Nội, dai hoc  nong nghiep ha noi,46
đại học thăng long,dai hoc thang long,78
đại học Ngân Hàng TPHCM,dai hoc ngan hang hcm,50
học viện tài chính,hoc vien tai chinh,78
Đại Học Duy Tân,dai hoc duy tan,53
Đại học nông lâm thái nguyên,dai hoc nong lam thai nguyen,75
Viện Đại Học Mở Hà Nội,vien dai hoc mo ha noi,52
Viện Đại Học Mở  Hà Nội,vien dai hoc mo ha noi,51
Đại học Kinh doanh và công nghệ Hà Nội,dai hoc kinh doanh cong nghe ha noi,68
DHBKHN, dai hoc  bach khoa hn,0
đại học Thương Mại,dai hoc thuong mai,56
The University of Greenwich,the university of greenwich,89
Đại học Ngoại thương,dai hoc ngoai thuong,65
Học viện Báo chí và Tuyên truyền,hoc vien bao chi tuyen truyen,69
Vietnam National University,vietnam national university,89
Đại học khoa học xã hội và nhân văn,dai hoc khoa hoc xa hoi nhan van,72
Natinal Economics University,natinal economics university,89
Đại học Hà Nội,dai hoc ha noi,50
đại học hải phòng,dai hoc hai phong,71
National Economics University,national economics university,90
Học Viện Ngoại Giao,hoc vien ngoai giao,68
đại học công nghệ thông tin - đại học quốc gia tphcm,dai hoc cong nghe thong tin   dai hoc quoc gia hcm,76
trường Đại học Thương mại,dai hoc thuong mai,51
Trường Đại học Thương mại,dai hoc thuong mai,51
Đại học Ngoại thương,dai hoc ngoai thuong,65
Cao Đẳng Nghề Công Nghiệp Hà Nội,cao dang nghe cong nghiep ha noi,59
Đại học kinh tế tp hcm,dai hoc kinh te  hcm,76
Trường Đại học Cần Thơ,dai hoc can tho,43
Đại học kinh tế tài chính,dai hoc kinh te tai chinh,76
Cao đẳng kinh tế đối ngoại,cao dang kinh te doi ngoai,73
Học viện công nghệ bưu chính viễn thông,hoc vien cong nghe buu chinh vien thong,77
ĐH Ngoại Thương, dai hoc  ngoai thuong,43
Học viện công nghệ bưu chính viễn thông,hoc vien cong nghe buu chinh vien thong,77
Ten lơ Man,ten lo man,70
Đại học Văn hoá Hà Nội,dai hoc van hoa ha noi,55
Đại học Văn hoá Hà Nội,dai hoc van hoa ha noi,55
Đại học Văn hoá Hà Nội,dai hoc van hoa ha noi,55
Đại học Văn hoá Hà Nội,dai hoc van hoa ha noi,55
Đại học Văn hoá Hà Nội,dai hoc van hoa ha noi,55
Đại học Văn hoá Hà Nội,dai hoc van hoa ha noi,55
Đại học Văn hoá Hà Nội,dai hoc van hoa ha noi,55
Cao Đẳng Kỹ Thuật Cao Thắng,cao dang ky thuat cao thang,63
Trường đại học kinh tế quốc dân,dai hoc kinh te quoc dan,65
huhhh,huhhh,100
báhhsh,bahhsh,83
Đại học Nguyễn Tất Thành,dai hoc nguyen tat thanh,62
Học viện công nghệ bưu chính viễn thông,hoc vien cong nghe buu chinh vien thong,77
Sài Gòn University,sai gon university,72
Công Nghiệp 4,cong nghiep 4,69
Công Nghiệp 4,cong nghiep 4,69
Trường Cao đẳng Kinh tế Đối Ngoại,cao dang kinh te doi ngoai,58
Đại học Hà Nội,dai hoc ha noi,50
xxs,xxs,100
hutech,hutech,100
Đại học Xã hội và Nhân văn,dai hoc xa hoi nhan van,63
Đại học Ngoại Ngữ,dai hoc ngoai ngu,59
Đại học Khoa học Xã hội và Nhân văn,dai hoc khoa hoc xa hoi nhan van,63
Đại học Thương Mại,dai hoc thuong mai,56
thang long,thang long,100
Trường Đại học Thủ Dầu Một,dai hoc thu dau mot,44
DH Khoa học Tự nhiên, dai hoc  khoa hoc tu nhien,55
Đại học kinh doanh và công nghệ Hà Nội,dai hoc kinh doanh cong nghe ha noi,71
đại học Tài Chính Marketing,dai hoc tai chinh marketing,70
Đại học Kinh doanh và Công nghệ Hà Nội,dai hoc kinh doanh cong nghe ha noi,66
Cao Đẳng Du Lịch Hà Nội,cao dang du lich ha noi,57
THCS Trần Đăng NInh,thcs tran dang ninh,47
fpt-arena,fpt arena,89
fpt-arena,fpt arena,89
Bach Khoa University,bach khoa university,85
Học viện tài chính,hoc vien tai chinh,72
Học viện tài chính,hoc vien tai chinh,72
"Troy University (USA) - School of International Education, Hanoi University of Science and Technology, Hanoi (Vietnam) ",troy university school of international education  hanoi university of science and technology  hanoi ,81
đại học kiến trúc đà nẵng,dai hoc kien truc da nang,68
Đại học Khoa học tự nhiên,dai hoc khoa hoc tu nhien,72
Đại học Khoa học tự nhiên,dai hoc khoa hoc tu nhien,72
Đại học Công Nghệ - ĐHQGHN,dai hoc cong nghe    dai hoc  quoc gia ha noi,34
Đại học Công Nghệ - ĐHQGHN,dai hoc cong nghe    dai hoc  quoc gia ha noi,34
Học viện Công nghệ Bưu chính Viễn thông,hoc vien cong nghe buu chinh vien thong,69
Đại học Tài Chính - Marketing,dai hoc tai chinh   marketing,69
BMG International Education,bmg international education,81
cao đẳng điện lực miền trung,cao dang dien luc mien trung,79
Trường đào tạo lái xe SAIGON,dao tao lai xe saigon,45
Đại học Thương mại,dai hoc thuong mai,61
đại học lâm nghiệp,dai hoc lam nghiep,72
học viện nông nghiệp việt nam,hoc vien nong nghiep viet nam,83
Đại học Khoa học Xã hội và Nhân văn,dai hoc khoa hoc xa hoi nhan van,63
Đại học Khoa học Xã hội và Nhân văn,dai hoc khoa hoc xa hoi nhan van,63
vượt qua sóng gió,vuot qua song gio,76
ĐH Ngân hàng TP. HCM, dai hoc  ngan hang   hcm,40
Đại học Bình Dương,dai hoc binh duong,56
đại học Tôn Đức Thắng,dai hoc ton duc thang,61
kinh tế quốc dân,kinh te quoc dan,81
Đại Học Ngoại Ngữ,dai hoc ngoai ngu,53
Đại học Kinh Tế Quốc Dân,dai hoc kinh te quoc dan,58
đại học điện lực,dai hoc dien luc,62
Học viện Ngoại giao Việt Nam (DAV),hoc vien ngoai giao viet nam ,67
"THPT Chuyên Lê Hồng Phong, Nam Định",thpt chuyen le hong phong  nam dinh,57
Thang Long University,thang long university,86
Đại học sư phạm thành phố Hồ Chí Minh,dai hoc su pham   hcm,48
Học viện Báo chí và Tuyên truyền,hoc vien bao chi tuyen truyen,66
Học viện CN Bưu chính viễn thông,hoc vien cong nghe buu chinh vien thong,62
Đại học Kinh tế Quốc dân,dai hoc kinh te quoc dan,67
đại học luật,dai hoc luat,67
Thpt Hác dich,thpt hac dich,77
Trường Đại học Nha Trang,dai hoc nha trang,59
Cao Đẳng Giao Thông Vận Tải 3,cao dang giao thong van tai 3,66
đại học công nghiệp,dai hoc cong nghiep,74
Bình Dương University,binh duong university,71
Trường DH kinh tế Quốc dân, dai hoc  kinh te quoc dan,54
đại học y thái bình ,dai hoc y thai binh,72
Chuyên Khoa Học Tự Nhiên,chuyen khoa hoc tu nhien,62
Hotel Insitute Montreux,hotel insitute montreux,87
thcs bình sơn,thcs binh son,85
Danang University of Economics,danang university of economics,90
Viet Nam National University Of Agriculture,viet nam national university of agriculture,86
Fpt university,fpt university,93
trường đại học võ trường toản,dai hoc vo truong toan,59
ĐH tài chính kế toán HN, dai hoc  tai chinh ke toan ha noi,53
Tây Nguyên University,tay nguyen university,76
ĐH Huế, dai hoc  hue,21
Đại học Ngoại Thương,dai hoc ngoai thuong,60
Đại học Ngoại Thương,dai hoc ngoai thuong,60
vạn xuân,van xuan,75
cao đẳng kinh tế công nghệ Hồ chí minh,cao dang kinh te cong nghe hcm,71
Hanoi Univercity,hanoi univercity,88
tôn đức thắng university,ton duc thang university,83
Đại Học Sư Phạm Kỹ Thuật Hưng Yên,dai hoc su pham ky thuat hung yen,52
Đại học FPT,dai hoc fpt,45
Hult international Business School,hult international business school,91
Trường Đại Học Kinh Tế Tp.HCM,dai hoc kinh te  hcm,37
ĐH Công Nghệ Thực Phẩm, dai hoc  cong nghe thuc pham,47
Cao Đẳng Nguyễn Văn Trỗi,cao dang nguyen van troi,62
ĐH công nghiệp thực phẩm, dai hoc  cong nghiep thuc pham,65
Đại học Bách Khoa Hà Nội,dai hoc bach khoa ha noi,58
Đại học Kinh tế Quốc Dân,dai hoc kinh te quoc dan,62
Đại học Bách Khoa Hà Nội,dai hoc bach khoa ha noi,58
Viện nghiên cứu Borstel,vien nghien cuu borstel,78
Cao đẳng công nghiệp Hà Nội - khoa điện tử,cao dang cong nghiep ha noi   khoa dien tu,69
cao đẳng điện tử điện lạnh hà nội,cao dang dien tu dien lanh ha noi,70
University of Economics HCMC,university of economics hcm,80
UNsw,unsw,50
Đại học Thể dục thể thao ,dai hoc the duc the thao,69
đại học quốc tế Hồng Bàng ,dai hoc quoc te hong bang,63
Khoa ngoại ngữ- Đại học Thái Nguyên,khoa ngoai ngu  dai hoc thai nguyen,69
ĐH Mỏ Địa Chất, dai hoc  mo dia chat,34
ĐH Kinh tế Quốc dân, dai hoc  kinh te quoc dan,53
cao đẳng du lịch hà nội,cao dang du lich ha noi,78
Đại học Kinh tế Huế,dai hoc kinh te hue,63
Cao Đẳng Công Nghệ_ Đại Học Đà Nẵng,cao dang cong nghe  dai hoc da nang,54
Đại học kinh tế Đà Nẵng,dai hoc kinh te da nang,65
Đại học khoa học công nghệ Lille 1,dai hoc khoa hoc cong nghe lille 1,79
"Đại học tổng hợp Saint-Petersburg, LB Nga",dai hoc tong hop saint petersburg  lb nga,71
Đại học giao thông vận tải,dai hoc giao thong van tai,77
Đại học công nghệ giao thông vận tải,dai hoc cong nghe giao thong van tai,78
Học viện tài chính,hoc vien tai chinh,72
University of Sunderland,university of sunderland,92
Đại học Sư phạm TP.HCM,dai hoc su pham  hcm,48
CAO ĐẲNG CÔNG NGHỆ TP HCM,cao dang cong nghe  hcm,21
DH Nông Lâm, dai hoc  nong lam,34
trường đại học kiến trúc đà nẵng,dai hoc kien truc da nang,60
Đại học Khoa học Tự nhiên,dai hoc khoa hoc tu nhien,68
CNTT,cntt,0
"University of Technology, Swinburne",university of technology  swinburne,89
Đại Học Kinh Tế TP. HCM,dai hoc kinh te   hcm,45
cao đẳng nghề quy nhơn bình định,cao dang nghe quy nhon binh dinh,78
Academy of Journalism and Communication,academy of journalism and communication,92
Đại học Công nghiệp Thực Phẩm Tp.HCM,dai hoc cong nghiep thuc pham  hcm,57
THCS QUẢNG CO THÀNH,thcs quang co thanh,16
đại học thể dục thể thao tp hồ chí minh,dai hoc the duc the thao  hcm,68
Đại học dầu khí Trung Quốc (Bắc Kinh),dai hoc dau khi trung quoc ,59
THPT Phan Đăng Lưu,thpt phan dang luu,50
Cao đẳng Công nghiệp Huế,cao dang cong nghiep hue,67
"University of Social Sciences and Humanities, HCMC",university of social sciences and humanities  hcm,83
Vinh Kim High School,vinh kim high school,80
Trường cao đẳng Viễn Đông,cao dang vien dong,56
Đại học Ngoại Thương,dai hoc ngoai thuong,60
Seoul National Uni,seoul national uni,83
Trường Cao Đẳng điện lực Miền Trung,cao dang dien luc mien trung,60
Đại học kinh doanh và công nghệ Hà Nội,dai hoc kinh doanh cong nghe ha noi,71
Đại học BKHN,dai hoc  bach khoa hn,30
THPT Nghề Phú Lâm,thpt nghe phu lam,44
Đại học Hoa Sen,dai hoc hoa sen,67
Đại học Lao động xã hội,dai hoc lao dong xa hoi,65
cao đẳng tài chính hải quan,cao dang tai chinh hai quan,81
Trường Đại học Tài chính - Marketing,dai hoc tai chinh   marketing,65
Đại Học Thủ Dầu Một,dai hoc thu dau mot,47
Đại Học GTVT TPHCM,dai hoc giao thong van tai hcm,21
Đại học Luật TP.HCM,dai hoc luat  hcm,44
Đại học KHXH&NV,dai hoc  khoa hoc xa hoi  nv,23
Đại học Bách Khoa,dai hoc bach khoa,65
Học viện Ngân hàng,hoc vien ngan hang,67
Đại học quốc tế Hồng Bàng,dai hoc quoc te hong bang,64
Đại học Kiến trúc Thành phố Hồ Chí Minh,dai hoc kien truc   hcm,48
Đại học Tôn Đức Thắng,dai hoc ton duc thang,57
CĐSP Hà Nam, cao dang su pham ha nam,23
Hội mỹ thuật Tp.HcM,hoi my thuat  hcm,56
THPT Quang Trung,thpt quang trung,62
Đại học Kinh tế Quốc dân,dai hoc kinh te quoc dan,67
Đại học Bách Khoa Thành phố Hồ Chí Minh,dai hoc bach khoa   hcm,48
Trường Công nghệ Châu Á Thái Bình Dương (AIT),cong nghe chau a thai binh duong ,51
Đại học Kiến trúc Hà Nội,dai hoc kien truc ha noi,58
tài chính marketing,tai chinh marketing,89
CĐ kinh tế kĩ thuật thương mại, cao dang  kinh te ki thuat thuong mai,65
Chuyên ngành : Quản trị kinh doanh tổng quát,chuyen nganh : quan tri kinh doanh tong quat,82
University of Stirling,university of stirling,91
HCMC University of Architecture,hcm university of architecture,82
Đại học Bách khoa Đà Nẵng,dai hoc bach khoa da nang,64
Học viện tài chính,hoc vien tai chinh,72
Học Viện Công Nghệ Bưu Chính Viễn Thông,hoc vien cong nghe buu chinh vien thong,59
Học viện tài chính,hoc vien tai chinh,72
Central Queensland University (CQU),central queensland university ,83
Đại học Khoa học Huế,dai hoc khoa hoc hue,65
đại học khoa học tự nhiên Hà Nội,dai hoc khoa hoc tu nhien ha noi,69
Trường đại học sư phạm tphcm,dai hoc su pham hcm,60
Đại Học Thăng Long,dai hoc thang long,61
trường cao đẳng nghề TPHCM,cao dang nghe hcm,51
Cao đẳng Hải Dương,cao dang hai duong,56
Đại học Duy Tân,dai hoc duy tan,60
THPT Ngô Gia Tự,thpt ngo gia tu,40
trường đại học Bình Dương,dai hoc binh duong,47
ĐH Kinh doanh và Công Nghệ , dai hoc  kinh doanh cong nghe,56
ĐH Kinh tế quốc dân, dai hoc  kinh te quoc dan,58
Đại học Kinh tế - Tài chính TPHCM,dai hoc kinh te   tai chinh hcm,59
Trường Cao Đẳng Công Thương TP.HCM,cao dang cong thuong  hcm,44
Trường Đại Học Sư Phạm Kỹ Thuật TP.HCM,dai hoc su pham ky thuat  hcm,39
Trường Cao Đẳng Thương Mại,cao dang thuong mai,49
Đại học Quy Nhơn,dai hoc quy nhon,62
CAO ĐẲNG GIAO THÔNG THÁI NGUYÊN,cao dang giao thong thai nguyen,16
ĐẠI HỌC KINH TẾ QUỐC DÂN,dai hoc kinh te quoc dan,21
Trường Cao đẳng công nghệ TP Đà nẵng,cao dang cong nghe  da nang,60
Học viện Báo chí và Tuyên truyền,hoc vien bao chi tuyen truyen,66
ĐH Tôn Đức Thắng, dai hoc  ton duc thang,41
Đại học Thương mại,dai hoc thuong mai,61
Đại học Trà Vinh,dai hoc tra vinh,62
Đại học Quốc gia Belarus,dai hoc quoc gia belarus,75
Học viện Tài chính LB Nga,hoc vien tai chinh lb nga,64
Trường DH kỹ thuật công nghệ, dai hoc  ky thuat cong nghe,57
Trường Đại học Thương Mại Hà Nội,dai hoc thuong mai ha noi,46
Hong Bang University ,hong bang university,83
Đại học kinh tế tpHCM,dai hoc kinh te hcm,60
Đại học kinh tế tpHCM,dai hoc kinh te hcm,60
trường đại học tây nguyên,dai hoc tay nguyen,60
thpt bình phú,thpt binh phu,93
thpt bình phú,thpt binh phu,93
thpt bình phú,thpt binh phu,93
FPT University,fpt university,71
Fpt Polytechnic,fpt polytechnic,87
thpt trần hưng đạo,thpt tran hung dao,78
"Đại học Hà Nội, Đại học Ngoại Thương",dai hoc ha noi  dai hoc ngoai thuong,56
Đại học Sài Gòn,dai hoc sai gon,53
University of Economics HCM city,university of economics hcm city,84
đh văn hiến, dai hoc  van hien,53
University of Sunderland,university of sunderland,92
học viện tài chính,hoc vien tai chinh,78
Trường trung cấp Đà Nẵng,trung cap da nang,59
Đại Học Lạc Hồng,dai hoc lac hong,50
ĐH Xây Dựng Hà Nội, dai hoc  xay dung ha noi,37
ĐH BÌNH DƯƠNG, dai hoc  binh duong,12
ĐH BÌNH DƯƠNG, dai hoc  binh duong,12
ĐH BÌNH DƯƠNG, dai hoc  binh duong,12
da nghi hoc,da nghi hoc,100
CAO ĐẲNG CÔNG NGHIỆP QUỐC PHÒNG,cao dang cong nghiep quoc phong,16
Trường Đại Học Y Dược Huế,dai hoc y duoc hue,37
Đại Học Cửu Long,dai hoc cuu long,56
Đại Học Cần Thơ,dai hoc can tho,47
Đại học Kinh doanh và công nghệ Hà Nội,dai hoc kinh doanh cong nghe ha noi,68
đại học xây dựng,dai hoc xay dung,69
Nguyen Tat Thanh University,nguyen tat thanh university,85
Đại học Giao thông vận tải,dai hoc giao thong van tai,79
hướng nghiệp Á Âu,huong nghiep a au,71
trường Giao thông Vận tải 3,giao thong van tai 3,68
Đại học bách khoa Đà Nẵng,dai hoc bach khoa da nang,68
học viện báo chí và tuyên truyền,hoc vien bao chi tuyen truyen,75
Đại học thương mại,dai hoc thuong mai,67
Trường Cao Đẳng Thương Mại - Đà Nẵng,cao dang thuong mai   da nang,49
cao đẳng xây dựng số 2,cao dang xay dung so 2,77
Trường đại học Ngoại ngữ - Tin học Tp.Hcm,dai hoc ngoai ngu   tin hoc  hcm,58
DHXD Miền Tây, dai hoc xd mien tay,30
Đại học kinh tế quốc dân,dai hoc kinh te quoc dan,75
"đại học công nghiệp, đại học kinh tế",dai hoc cong nghiep  dai hoc kinh te,72
Đại học sư phạm hà nội,dai hoc su pham ha noi,68
THPT Phạm Hồng Thái,thpt pham hong thai,47
cao đẳng nghề du lịch Đà Nẵng,cao dang nghe du lich da nang,72
đại học kiến trúc hà nội,dai hoc kien truc ha noi,71
Đại học công nghiệp Tp.HCM,dai hoc cong nghiep  hcm,60
Đại Học Hoa Sen,dai hoc hoa sen,60
Đại Học Hoa Sen,dai hoc hoa sen,60
Đại học Ngoại Thương,dai hoc ngoai thuong,60
Đại học kinh tế kỹ thuật công nghiệp,dai hoc kinh te ky thuat cong nghiep,78
đại học công nghiệp thành phố hồ chí minh,dai hoc cong nghiep   hcm,61
Viet Uc College,viet uc college,80
đh kinh tế quốc dân, dai hoc  kinh te quoc dan,67
Trường Đại học Hà Nội,dai hoc ha noi,40
đại học Hà Nội,dai hoc ha noi,62
Trường Đại học Lao động-Xã hội CSII,dai hoc lao dong xa hoi co so  2 ,41
trung học phổ thông Hoàng Diệu,trung hoc pho thong hoang dieu,77
Đại Học Khoa Học Tự Nhiên Hà Nội,dai hoc khoa hoc tu nhien ha noi,53
Colledge of Finance & Customs,colledge of finance   customs,86
Cao ĐẲNG Nghề SAIGON,cao dang nghe saigon,33
ĐH Bách Khoa Hà Nội, dai hoc  bach khoa ha noi,44
FSB,fsb,0
Đại học Thủy Lợi,dai hoc thuy loi,56
THPT Lý Tự Trọng,thpt ly tu trong,38
Trung cấp Công Nghệ Thú Y TP.HCM,trung cap cong nghe thu y  hcm,55
đại học thuỷ lơi,dai hoc thuy loi,69
Nanyang Technology University,nanyang technology university,90
đại học sư phạm hà nội,dai hoc su pham ha noi,68
Trường GTVT 2,giao thong van tai 2,30
Đại Học Thương Mại,dai hoc thuong mai,62
Đại học Công Nghiệp,dai hoc cong nghiep,68
Kinh doanh công nghệ Hà Nội,kinh doanh cong nghe ha noi,74
hv công nghệ bưu chính viễn thông,hv cong nghe buu chinh vien thong,82
"Đại học Bà Rịa - Vũng Tàu, Tp. Vũng Tàu",dai hoc ba ria   vung tau    vung tau,50
Đại học Tôn Đức Thắng,dai hoc ton duc thang,57
Học viện Ngân hàng,hoc vien ngan hang,67
Đại học Luật Hà Nội,dai hoc luat ha noi,53
đại học hà nội,dai hoc ha noi,64
Đại Học Công Nghiệp Hà Nội,dai hoc cong nghiep ha noi,54
trung cấp tổng hợp Đông Nam Á,trung cap tong hop dong nam a,76
đại học thắng long,dai hoc thang long,78
Đại học Mở Tp HCM,dai hoc mo  hcm,44
Trường Đại học Kinh tế - Luật,dai hoc kinh te   luat,55
Đại học Kiến Trúc Đà Nẵng,dai hoc kien truc da nang,56
Viện Đại học Mở Hà Nội,vien dai hoc mo ha noi,50
ĐH Khoa học xã hội và Nhân văn, dai hoc  khoa hoc xa hoi nhan van,56
Đại học ngoại ngữ - ĐHQGHN,dai hoc ngoai ngu    dai hoc  quoc gia ha noi,39
trung cấp y tế,trung cap y te,86
cao đẳng xây dựng số 2,cao dang xay dung so 2,72
Đại học Mở,dai hoc mo,50
Trường Đại Học Kỹ Thuật Công Nghiệp,dai hoc ky thuat cong nghiep,51
Đại học Kinh Tế Quốc Dân,dai hoc kinh te quoc dan,58
Cao Đẳng Kinh Tế Tp. Hồ Chí Minh,cao dang kinh te   hcm,52
Cao Đẳng Kinh Tế Tp. Hồ Chí Minh,cao dang kinh te   hcm,52
cao đẳng kinh tế kỹ thuật Vinatex,cao dang kinh te ky thuat vinatex,82
ĐẠI HỌC KINH TẾ TPHCM,dai hoc kinh te hcm,20
NIIT,n 2 t,0
Nông Lâm Tp.HCM,nong lam  hcm,36
cao đẳng y tế bạc liêu,cao dang y te bac lieu,77
