raw,new,score
cao đẳng nghề công nghiệp hà nội,cao dang nghe cong nghiep ha noi,78
Đại học Tôn Đức Thắng,dai hoc ton duc thang,57
"Trường CĐN Sóc Trăng,  Trường CĐN Số 9",cao dang nghe soc trang  truong cao dang nghe so 9,41
Đại học Công Nghệ TPHCM,dai hoc cong nghe hcm,50
Trường Đại học Kinh Tế Tp HCM,dai hoc kinh te  hcm,49
Văn Lang University,van lang university,79
ĐHYD TPHCM, dai hoc yd hcm,8
học viện hàng không việt nam,hoc vien hang khong viet nam,82
Đại học lao động xã hội cơ sở 2,dai hoc lao dong xa hoi co so 2,71
trung cấp nghề cho người khuyết tật,trung cap nghe cho nguoi khuyet tat,83
Trường Đại học Công nghệ Tp HCM,dai hoc cong nghe  hcm,53
Đại học Mỹ thuật TP.HCM,dai hoc my thuat  hcm,50
trường dạy nghề thanh xuân,day nghe thanh xuan,71
Đại học luật thành phố Hồ Chí Minh,dai hoc luat   hcm,46
IIG Vietnam, 2 g vietnam,61
Đại học Luật thành phố Hồ Chí Minh,dai hoc luat   hcm,42
Đại Học Dân lập Văn Hiến,dai hoc dan lap van hien,54
dai hoc mo dia chat,dai hoc mo dia chat,100
Đại học Công nghiệp Hà Nội,dai hoc cong nghiep ha noi,62
Cao Đẳng Du Lịch Hà Nội,cao dang du lich ha noi,57
đại học ngân hàng tp hcm,dai hoc ngan hang  hcm,74
đại học công nghiệp tphcm,dai hoc cong nghiep hcm,75
cd duyên hải, cao dang  duyen hai,62
Viện đào tạo sau đại hoc kinh tế quốc dân,vien dao tao sau dai hoc kinh te quoc dan,76
Ho Chi Minh Bach Khoa University,hcm bach khoa university,68
Đại Học Ngân Hàng TP.HCM,dai hoc ngan hang  hcm,43
cao đẳng kinh tế kỹ thuật thành phố hồ chí minh,cao dang kinh te ky thuat   hcm,67
Công nghiệp thực phẩm,cong nghiep thuc pham,76
đại học kinh tế quốc dân hà nội,dai hoc kinh te quoc dan ha noi,76
viện đại học mở hà nội,vien dai hoc mo ha noi,72
Đại học Kinh tế Quốc dân,dai hoc kinh te quoc dan,69
Đại học Văn Lang,dai hoc van lang,62
nam khoai chau,nam khoai chau,100
truong  day nghe,day nghe,67
Cao dang nghe đa. lat,cao dang nghe da  lat,86
Cao đẳng kinh tế đối ngoại,cao dang kinh te doi ngoai,73
trường CĐSP Ninh Thuan, cao dang su pham ninh thuan,48
Trương cao đăng quôc tê TP.HCM,cao dang quoc te  hcm,51
ĐH điện lực, dai hoc  dien luc,41
Đại học Tài chính - Marketing,dai hoc tai chinh   marketing,72
Trường Cao đẳng Sư phạm trung ương TP.Hồ Chí Minh,cao dang su pham trung uong  hcm,54
Huflit,huflit,83
saigontourist ,saigontourist,96
Đại Học Sư Phạm Kỹ Thuật TP Hồ Chí Minh,dai hoc su pham ky thuat  hcm,51
Đại học Ngoại Thương,dai hoc ngoai thuong,60
Cao Đẳng Văn Hoá Nghệ Thuật và Du Lịch Sài Gòn,cao dang van hoa nghe thuat du lich sai gon,56
Đại Học Mở,dai hoc mo,40
truong cao dabg kinh te ky thuat mien nam,cao dabg kinh te ky thuat mien nam,91
dai hoc lac hong,dai hoc lac hong,100
Đại học Mở,dai hoc mo,61
không yêu cầu,khong yeu cau,74
đại học hồng bàng,dai hoc hong bang,71
Cao đẳng Công Thương TPHCM,cao dang cong thuong hcm,52
thpt bến tắm,thpt ben tam,83
Đại học Kỹ Thuật Công Nghệ HCM,dai hoc ky thuat cong nghe hcm,53
Cao Đẳng Kinh Tế Đối Ngoại,cao dang kinh te doi ngoai,62
truong trung hoc kien tuong,trung hoc kien tuong,85
Đại học SP Thái Nguyên,dai hoc su pham thai nguyen,53
Đại học Ngân hàng TPHCM,dai hoc ngan hang hcm,55
Học  Viện Hành Chính Quốc Gia ,hoc vien hanh chinh quoc gia,59
Đại học Công nghệ giao thông vận tải,dai hoc cong nghe giao thong van tai,75
đại học mỏ địa chất,dai hoc mo dia chat,63
Cao đẳng truyền hình,cao dang truyen hinh,75
công nghiệp tuy hòa,cong nghiep tuy hoa,84
giáo dục thường xuyên long điền,giao duc thuong xuyen long dien,77
Cao Đẳng Nghề Thủ Đức,cao dang nghe thu duc,57
Cao Đẳng Công Nghệ Sài Gòn,cao dang cong nghe sai gon,58
ĐH Ngoại ngữ tin học TPHCM, dai hoc  ngoai ngu tin hoc hcm,53
việt xô,viet xo,67
đại học nguyễn tất thành,dai hoc nguyen tat thanh,75
Đại học Khoa học Tự nhiên - Đại học quốc gia HCM,dai hoc khoa hoc tu nhien   dai hoc quoc gia hcm,67
cao dang y te tien giang,cao dang y te tien giang,100
Đại Học Văn Hóa Thể Thao và Du Lịch Thanh Hóa,dai hoc van hoa the thao du lich thanh hoa,57
vinh loc a,vinh loc a,100
nguyen thai binh,nguyen thai binh,100
trung cap van Thu luu tru trung uong,trung cap van thu luu tru trung uong,97
Đại Học Công Nghiệp Hà Nội,dai hoc cong nghiep ha noi,60
Cao đẳng Bán công Công Nghệ & Quản Trị Doanh Nghiệp,cao dang ban cong cong nghe   quan tri doanh nghiep,65
Trung Học phổ thông Lý Tự Trọng,trung hoc pho thong ly tu trong,65
Cao đẳng du lịch hà nội,cao dang du lich ha noi,74
đại học văn lang,dai hoc van lang,75
Học Viện Nông Nghiệp Việt Nam,hoc vien nong nghiep viet nam,62
Cao đẳng kinh tế Tp. Hồ Chí Minh,cao dang kinh te   hcm,59
thpt lý tự trọng,thpt ly tu trong,81
thpt lý tự trọng,thpt ly tu trong,81
Trường đại học lâm nghiệp,dai hoc lam nghiep,60
đại học kinh tế kĩ thuật công nghiệp,dai hoc kinh te ki thuat cong nghiep,78
trương an,an,36
Nguyễn trung trực,nguyen trung truc,82
trung tâm giới thiệu việc làm tây ninh,trung tam gioi thieu viec lam tay ninh,84
Đại học kinh tế kỹ thuật công nghiệp,dai hoc kinh te ky thuat cong nghiep,78
Đại học Kinh tế TP HCM,dai hoc kinh te  hcm,57
fpt arena,fpt arena,100
Cao Đẳng sư phạm trung ương,cao dang su pham trung uong,74
Trung Cấp Bách Khoa Bình Dương,trung cap bach khoa binh duong,63
Cao Đẳng Công Thương,cao dang cong thuong,60
CĐ Kinh tế Đối ngoại, cao dang  kinh te doi ngoai,54
THPT Bình Phú,thpt binh phu,38
trường tc miền Tây. tp cần thơ,tc mien tay   can tho,59
Đại học Văn Lang,dai hoc van lang,62
ttđt tiến bộ,ttdt tien bo,75
đại học Bách Khoa Hà Nội,dai hoc bach khoa ha noi,58
Truong Cao Dang Dai Viet Sai Gon,cao dang dai viet sai gon,67
Trường đại học Tôn Đức Thắng,dai hoc ton duc thang,49
Trường Đại học Kinh tế - Luật,dai hoc kinh te   luat,55
Đại học Công Nghiệp Hà Nội,dai hoc cong nghiep ha noi,58
trung cấp kinh tế kĩ thuật sài gòn,trung cap kinh te ki thuat sai gon,82
Trung Học phổ thông Tân Phong,trung hoc pho thong tan phong,72
Đại học Quản trị kinh doanh,dai hoc quan tri kinh doanh,78
đại học giao thông vận tải hà nội,dai hoc giao thong van tai ha noi,76
Cao đẳng Công Nghiệp Tuy Hoà,cao dang cong nghiep tuy hoa,64
Đại học Luật Hà Nội,dai hoc luat ha noi,53
Đại học ngoại ngữ tin học tphcm,dai hoc ngoai ngu tin hoc hcm,77
Cao Đẳng Kinh Tế Đối Ngoại,cao dang kinh te doi ngoai,62
Trường thpt Trần Nguyên Hản,thpt tran nguyen han,60
Trường Đại Học Sư Phạm Kỹ Thuật Hưng Yên,dai hoc su pham ky thuat hung yen,47
Đại Học Điện Lực,dai hoc dien luc,50
Hutech,hutech,83
Foreign Trade University,foreign trade university,88
kent,kent,100
Trường cao đẳng kinh tế kỹ thuật sài gòn,cao dang kinh te ky thuat sai gon,71
Đại học Ngoại Ngữ và Tin Học Thành phố Hồ Chí Minh,dai hoc ngoai ngu tin hoc   hcm,47
thieu sinh quan,thieu sinh quan,100
vạn hạnh,van hanh,75
Đại học Kinh tế Quốc dân,dai hoc kinh te quoc dan,67
Đại học Luật thành phố Hồ Chí Minh,dai hoc luat   hcm,42
Trung Hoc Pho Thong Hoa Da,trung hoc pho thong hoa da,77
cấp 2,cap 2,80
trung học phổ thông nguyễn cômg hoan,trung hoc pho thong nguyen comg hoan,86
trần quốc tuấn,tran quoc tuan,79
ĐH Giao thông vận tải Tp Hồ Chí Minh, dai hoc  giao thong van tai  hcm,52
Đại học Kinh doanh và Công nghệ Hà Nội,dai hoc kinh doanh cong nghe ha noi,66
Cao Đẳng Thực hành FPT Polytechnic Đà Nẵng,cao dang thuc hanh fpt polytechnic da nang,67
cao đẳng công nghệ thông tin hữu nghị Việt - Hàn Đà Nẵng,cao dang cong nghe thong tin huu nghi viet   han da nang,71
Trường Cao đẳng Sư phạm Ninh Thuận,cao dang su pham ninh thuan,58
Đại Học Sài Gòn,dai hoc sai gon,47
THPT Thanh Chương 3,thpt thanh chuong 3,58
cao đẳng điện lực,cao dang dien luc,71
Cao đẳng sư phạm Nha Trang,cao dang su pham nha trang,73
Đại học Mở Hà Nội,dai hoc mo ha noi,47
esuhai,esuhai,100
TTGDNN-GDTXHTT,ttgdnn  gia duc thuong xuyen htt,0
Trường CĐ GTVT, cao dang  giao thong van tai,19
Trường THPT vĩnh hải,thpt vinh hai,42
hutech,hutech,100
trung cấp bến thành,trung cap ben thanh,84
Đại học Khoa Học Tự Nhiên thành phố Hồ Chí Minh.,dai hoc khoa hoc tu nhien   hcm ,50
truờng đh công nghiệp hà nội, dai hoc  cong nghiep ha noi,61
Trường ĐH Hùng Vương TPHCM, dai hoc  hung vuong hcm,32
THCS Trường Thọ,thcs truong tho,40
trường trung cấp nghiệp vụ Nam Sài Gòn,trung cap nghiep vu nam sai gon,67
trung tam ho tro phat trien kinh te thanh nien,trung tam ho tro phat trien kinh te thanh nien,100
đại học y dược tphcm,dai hoc y duoc hcm,68
Đại học Tôn Đức Thắng,dai hoc ton duc thang,57
cao dăng y đọc pasteur,cao dang y doc pasteur,86
Đông Tân,dong tan,50
salon ngọc hà,salon ngoc ha,85
đại học sư phạm kỹ thuật tp.hồ chi minh,dai hoc su pham ky thuat  hcm,62
chao yang university of technology,chao yang university of technology,100
Học Viện Ngân Hàng,hoc vien ngan hang,56
City University of Seattle,city university of seattle,88
đại học mở hà nội,dai hoc mo ha noi,65
Đại học công lập Tôn Đức Thắng tpHCM,dai hoc cong lap ton duc thang hcm,57
THPT chuyên Thoại Ngọc Hầu,thpt chuyen thoai ngoc hau,58
trường trung học cơ sở phước thiền,trung hoc co so phuoc thien,69
Đại học Sư phạm Tp.HCM,dai hoc su pham  hcm,58
Cao đẳng kinh tế công nghệ tphcm,cao dang kinh te cong nghe hcm,77
đại học giao thông vận tải,dai hoc giao thong van tai,77
Học viện cán bộ tp HCM,hoc vien can bo  hcm,57
Viện Đại Học Mở Hà Nội,vien dai hoc mo ha noi,45
Trường THPT M.V.Lomonoxop,thpt m v lomonoxop,47
trường  cao đẳng  nghề  Ladec,cao dang nghe ladec,62
Đại Học Công Nghiệp Thành Phố Hồ Chí Minh,dai hoc cong nghiep   hcm,45
ĐẠI HỌC SƯ PHẠM NGHỆ THUẬT TW,dai hoc su pham nghe thuat tw,21
Học viện Tài Chính,hoc vien tai chinh,61
Đại học lao động xã hội,dai hoc lao dong xa hoi,70
Đại học Kinh tế Quốc dân,dai hoc kinh te quoc dan,67
Đại Học Văn Lang,dai hoc van lang,56
Học viện Ngân Hàng,hoc vien ngan hang,61
truong cao đẳng kỹ thuật Lý Tự Trọng,cao dang ky thuat ly tu trong,58
ĐH KHXH&NV, dai hoc   khoa hoc xa hoi  nv,5
trung học cơ sở thái hòa,trung hoc co so thai hoa,79
Trường Đại Học Khoa Học Xã Hội Và Nhân Văn,dai hoc khoa hoc xa hoi nhan van,46
đại học Kinh Tế - Luật,dai hoc kinh te   luat,59
trường Đại học lao động xã hội,dai hoc lao dong xa hoi,60
Đại học Thương mại,dai hoc thuong mai,61
bùi thị xuân,bui thi xuan,75
trung cấp dược trung ương,trung cap duoc trung uong,80
ĐH FPT, dai hoc  fpt,11
Đại học Sư Phạm Kỹ Thuật TPHCM,dai hoc su pham ky thuat hcm,48
Don Bosco,don bosco,78
Học viện tài chính,hoc vien tai chinh,72
Viện Đại học Mở Hà Nội,vien dai hoc mo ha noi,50
Học Viện Tài Chính,hoc vien tai chinh,56
Cao Đẳng y  tế Đồng Nai,cao dang y te dong nai,67
thpt đại an,thpt dai an,82
Đại Học Lạc Hồng,dai hoc lac hong,50
Trường đại học Nông Lâm TPHCM,dai hoc nong lam hcm,41
sư phạm cà mau,su pham ca mau,79
Đại học Sư Phạm Kỹ Thuật TPHCM,dai hoc su pham ky thuat hcm,48
Cao Đẳng Nghề Du Lịch Sài Gòn,cao dang nghe du lich sai gon,59
Saigontourist,saigontourist,92
huynh phi hung ca mau,huynh phi hung ca mau,100
Đại học Vinh,dai hoc vinh,67
arena multimedia,arena multimedia,100
Đại học luật TP HCM,dai hoc luat  hcm,56
Trường Đại học Công Nghiệp TPHCM,dai hoc cong nghiep hcm,47
kim đồng,kim dong,75
trường đại học lạc hồng,dai hoc lac hong,56
Đại học Công Đoàn,dai hoc cong doan,59
CD KT- KT Vinatex TpHCM, cao dang  kt  kt vinatex hcm,38
truong cao dang cong thuong thanh pho ho chi minh,cao dang cong thuong   hcm,69
giồng ông tô,giong ong to,75
Đại học Quy Nhơn,dai hoc quy nhon,62
Đại học Văn Hiến,dai hoc van hien,56
Khoa học tự nhiên Tp.HCM,khoa hoc tu nhien  hcm,61
Trường NVDLKS VIỆT GIAO,nvdlks viet giao,15
thcs,thcs,100
Trường NVDLKS VIỆT GIAO,nvdlks viet giao,15
cao đẳng cộng đồng hà nội,cao dang cong dong ha noi,72
Trường Trung Cấp Y Tế Sóc Trăng,trung cap y te soc trang,51
truong trung hoc co so an thanh,trung hoc co so an thanh,87
Đại học Bách khoa Hà Nội,dai hoc bach khoa ha noi,62
học viện âm nhạc thành phố,hoc vien am nhac  ,64
trung hoc co so,trung hoc co so,100
Đại học khoa học xh và nhân văn,dai hoc khoa hoc xh nhan van,75
trung cấp phương nam,trung cap phuong nam,85
Trường Đại Học Kinh Tế Quốc Dân,dai hoc kinh te quoc dan,47
Cao đẳng Kinh Tế - Công nghệ TPHCM,cao dang kinh te   cong nghe hcm,58
học viện tài chính,hoc vien tai chinh,78
Cao Đẳng Tài Chính Hải Quan,cao dang tai chinh hai quan,63
Trường Đại học Công Nghệ TP Hcm Hutech,dai hoc cong nghe  hcm hutech,60
Đại học Tôn Đức Thắng,dai hoc ton duc thang,57
đại học nguyễn tất thành,dai hoc nguyen tat thanh,75
Đại học Bình Dương,dai hoc binh duong,56
Đại học Thiên Tân Trung Quốc,dai hoc thien tan trung quoc,64
Trường đại học Thiên Tân Trung Quốc,dai hoc thien tan trung quoc,57
Lữ Đoàn Đặc công 429,lu doan dac cong 429,65
THPT Lê Trung Đình,thpt le trung dinh,50
Saigon Tech University,saigon tech university,86
Đại học Bách Khoa TP.HCM,dai hoc bach khoa  hcm,52
Đại học Kiến Trúc TP.HCM,dai hoc kien truc  hcm,48
truong cdktkt thuong mai, cao dang ktkt thuong mai,78
đại học thành đông,dai hoc thanh dong,67
thpt an ninh,thpt an ninh,100
Đại học bách khoa Đà Nẵng,dai hoc bach khoa da nang,68
Trường đại học mở Tp hcm,dai hoc mo  hcm,56
học viện nghiên cứu và đào tạo digital marketing Vinalink,hoc vien nghien cuu dao tao digital marketing vinalink,83
Trung tâm quan tới mang và an ninh mang quốc tế Athena,trung tam quan toi mang an ninh mang quoc te athena,86
trường đại học công nghiệp tp hcm,dai hoc cong nghiep  hcm,67
trung học cơ sở ngô mây,trung hoc co so ngo may,78
Đại học Luật Hà Nội,dai hoc luat ha noi,53
Học viện Thanh thiếu niên Việt Nam,hoc vien thanh thieu nien viet nam,74
Trung Cấp Nghề Cơ Điện Tam Điệp- Ninh Bình,trung cap nghe co dien tam diep  ninh binh,62
kinh tế quốc dân,kinh te quoc dan,81
Đại học Tôn Đức Thắng,dai hoc ton duc thang,57
trường thpt  hựu thành,thpt huu thanh,67
Đại học Thành Đô,dai hoc thanh do,56
đại học công nghiệp tphcm,dai hoc cong nghiep hcm,75
CĐ Kỹ Thuật Cao Thắng, cao dang  ky thuat cao thang,48
Học viện kỹ thuật quân sự,hoc vien ky thuat quan su,72
Can Tho University,can tho university,83
Đại học khoa học,dai hoc khoa hoc,86
đại học giao thông vận tải hà nội,dai hoc giao thong van tai ha noi,76
Đại học Văn Lang,dai hoc van lang,62
Đại Học Khoa học Tự Nhiên TP.HCM,dai hoc khoa hoc tu nhien  hcm,52
đại học bách khoa hà nội,dai hoc bach khoa ha noi,75
Cao Đẳng CNC Binh Dương,cao dang cnc binh duong,57
viện đại học mở hà nội,vien dai hoc mo ha noi,72
Học viện Hàng không Việt Nam,hoc vien hang khong viet nam,70
Ca Mau Service of Education & Training,ca mau service of education   training,84
Management Quality Institute,management quality institute,89
Đại học Hoa Sen,dai hoc hoa sen,67
Học viện tài chính,hoc vien tai chinh,72
Tampere University of Applied Sciences,tampere university of applied sciences,89
trung cấp dược tuệ tĩnh,trung cap duoc tue tinh,78
Đại Học Giao Thông Vận Tải Thành Phố Hồ Chí Minh,dai hoc giao thong van tai   hcm,48
trung học phổ thông,trung hoc pho thong,84
Trung cấp kinh tế Quảng Ninh,trung cap kinh te quang ninh,79
Trường Đại Học Bình Dương,dai hoc binh duong,42
Trường đào tạo Công nghệ May Quốc Thảo,dao tao cong nghe may quoc thao,58
Đại học kiến trúc Hà Nội,dai hoc kien truc ha noi,62
Trường Đại học Công nghệ Thông tin - Đại học Quốc gia TP.HCM,dai hoc cong nghe thong tin   dai hoc quoc gia  hcm,59
không có,khong co,75
đại học Quang Trung,dai hoc quang trung,74
Học viện nông nghiệp việt nam,hoc vien nong nghiep viet nam,79
Đại học Công nghiệp Hà Nội,dai hoc cong nghiep ha noi,62
Trung Tâm Bồi Dưỡng Và Nghiệp Vụ CATP ĐN,trung tam boi duong nghiep vu ca dn,51
hutech,hutech,100
Đại Học Công Nghiệp Bắc Hà,dai hoc cong nghiep bac ha,54
IMgroup,imgroup,71
Đại học kinh tế TP Hồ Chí Minh,dai hoc kinh te  hcm,56
học viện nông nghiệp việt nam,hoc vien nong nghiep viet nam,83
lái xe tải,lai xe tai,80
Trung cấp sư phạm mẫu giáo trung ương,trung cap su pham mau giao trung uong,78
Đại Học Văn Lang ,dai hoc van lang,55
Cao đẳng Kinh tế Đối ngoại,cao dang kinh te doi ngoai,69
đại học công nghiệp tphcm,dai hoc cong nghiep hcm,75
ĐẠI HỌC GIAO THÔNG VẬN TẢI,dai hoc giao thong van tai,19
đại học công nghiệp tphcm,dai hoc cong nghiep hcm,75
đại học mỏ địa chất,dai hoc mo dia chat,63
đại học mỏ địa chất ,dai hoc mo dia chat,62
trung cấp tổng hợp hà nội,trung cap tong hop ha noi,80
itplus,ilus,80
itplus,ilus,80
học viện kĩ thuật mật mã,hoc vien ki thuat mat ma,75
đại học luật hà nội,dai hoc luat ha noi,68
co so 3 pccc,co so 3 pccc,100
tai nguyên và môi trường tp.hcm,tai nguyen moi truong  hcm,74
trubg cap kt _ du lich tphcm,trubg cap kt   du lich hcm,93
Đại học Luật Tp.HCM,dai hoc luat  hcm,44
cao đẳng phương đông,cao dang phuong dong,70
học viện hàng không việt nam,hoc vien hang khong viet nam,82
Đại học Khoa học xã hội và Nhân văn,dai hoc khoa hoc xa hoi nhan van,66
tôn đức thắng,ton duc thang,69
ky thuat cao thang,ky thuat cao thang,100
ĐH Ngoại thương, dai hoc  ngoai thuong,49
Đại học Cần thơ,dai hoc can tho,60
Trường Đại học Ngoại thương cơ sở 2,dai hoc ngoai thuong co so 2,60
Cao đẳng công nghiệp Tuy hoà,cao dang cong nghiep tuy hoa,75
Đại học Giao Thông Vận Tải,dai hoc giao thong van tai,62
trung cấp quân y 1,trung cap quan y 1,89
Văn Lang University,van lang university,79
Cao đẳng Kinh Tế Công Nghệ TP.HCM,cao dang kinh te cong nghe  hcm,53
Đại học tài nguyên và môi trường Hà Nội,dai hoc tai nguyen moi truong ha noi,64
trung cấp nghề,trung cap nghe,86
DH Sư phạm Nghệ thuật TƯ, dai hoc  su pham nghe thuat tu,51
Đại học Khoa Học Tự Nhiên - ĐHQGTPHCM,dai hoc khoa hoc tu nhien    dai hoc  quoc gia hcm,39
Cao đẳng Kỹ thuật Việt nam Singapore,cao dang ky thuat viet nam singapore,75
trung cấp kinh tế kỹ thuật bình định,trung cap kinh te ky thuat binh dinh,81
HN Aptech,hn aptech,67
trung học BCVT & CNTT ,trung hoc bcvt   cntt,56
thpt nguyen viet xuan,thpt nguyen viet xuan,100
Đại Học Ngoại Ngữ Đà Nẵng,dai hoc ngoai ngu da nang,52
trung hoc co so dong hoa,trung hoc co so dong hoa,100
dh thành tây, dai hoc  thanh tay,65
Đh Khoa Học Tự Nhiên TPHCM, dai hoc  khoa hoc tu nhien hcm,47
Học viện tài chính,hoc vien tai chinh,72
Trung cấp Âu Việt,trung cap au viet,71
dhxd Miền Tây, dai hoc xd mien tay,55
Học viện hành chính quốc gia,hoc vien hanh chinh quoc gia,79
Học viện Báo chí và Tuyên truyền,hoc vien bao chi tuyen truyen,66
đại học sư phạm Hà Nội,dai hoc su pham ha noi,59
Đại học Sài Gòn,dai hoc sai gon,53
Đại Học Lạc Hồng,dai hoc lac hong,50
Đại học Tôn Đức Thắng,dai hoc ton duc thang,57
không ,khong,73
đại học y dược tp.hcm,dai hoc y duoc  hcm,65
trung cấp quân y 2,trung cap quan y 2,89
Trường Cao Đẳng Công Nghệ Thông Tin TP HCM,cao dang cong nghe thong tin  hcm,53
Trưòng CĐ nghề số 8, cao dang  nghe so 8,56
trung hoc phô thông yên thành 3,trung hoc pho thong yen thanh 3,87
dh ha tinh, dai hoc  ha tinh,74
PSB Academy - Singapore,psb academy   singapore,74
Đào tạo bếp vàng,dao tao bep vang,69
FPT Polytechnic,fpt polytechnic,73
Trường Đại học Nông Lâm,dai hoc nong lam,46
đại học khoa học xã hội và nhân văn đại học quốc gia thành phố hồ chí minh,dai hoc khoa hoc xa hoi nhan van dai hoc quoc gia   hcm,67
Cao Đẳng Công Nghệ Thủ Đức,cao dang cong nghe thu duc,58
Family Montessori Pre-school,family montessori pre school,86
 Cao đẳng kỹ nghệ 2,cao dang ky nghe 2,70
Cao Đẳng Kỹ Nghệ 2,cao dang ky nghe 2,61
Đại học Luật Thành phố Hồ Chí Minh,dai hoc luat   hcm,42
đại học thủy lợi,dai hoc thuy loi,69
Đại Học Tôn Đức Thắng,dai hoc ton duc thang,52
ĐH Văn Lang, dai hoc  van lang,41
CD Kinh Tế Kĩ Thuật VNT TP HCM, cao dang  kinh te ki thuat vnt  hcm,39
truong khuyet tat ben tre,khuyet tat ben tre,84
Trường Cao Đẳng kinh tế công nghệ tp.hcm,cao dang kinh te cong nghe  hcm,68
Lai xe thu duc,lai xe thu duc,93
đại học tài chính quản trị kinh doanh,dai hoc tai chinh quan tri kinh doanh,81
Cao đẳng Kinh tế đối ngoại,cao dang kinh te doi ngoai,69
trung tâm đào tạo quốc tế Kent,trung tam dao tao quoc te kent,77
mỏ địa chất,mo dia chat,64
đại học công nghiệp thực phẩm,dai hoc cong nghiep thuc pham,76
hoa sữa,hoa sua,86
Đại học Mở TPHCM,dai hoc mo hcm,40
Đại học Văn hóa Thành phố Hồ Chí Minh,dai hoc van hoa   hcm,45
Trường Đại Học Lạc Hồng,dai hoc lac hong,41
Hutech University,hutech university,88
THPT Việt Nam Ba Lan,thpt viet nam ba lan,55
Trung tâm giáo dục thường xuyên tỉnh Cần Thơ,trung tam giao duc thuong xuyen tinh can tho,73
Đại Học Tây Nguyên,dai hoc tay nguyen,63
Đại học Ngân Hàng Tp. Hồ Chí Minh,dai hoc ngan hang   hcm,50
đại học Văn Hóa tp.HCM,dai hoc van hoa  hcm,43
cao đẳng y tế Kiên Giang,cao dang y te kien giang,75
trường Văn hóa - nghệ thuật Kiên Giang,van hoa   nghe thuat kien giang,64
Đại học Luật Tp.HCM,dai hoc luat  hcm,44
đại học cần thơ,dai hoc can tho,67
Đại học xây dụng,dai hoc xay dung,69
dai hoc su pham ky thuat,dai hoc su pham ky thuat,100
sư phạm kỹ thuật,su pham ky thuat,75
cao đẳng sư phạm trung ương nha trang,cao dang su pham trung uong nha trang,84
cao đẳng thương mại và du lịch hà nôi và đã từng học khóa ktoans thực tế chuyên sâu,cao dang thuong mai du lich ha noi da tung hoc khoa ktoans thuc te chuyen sau,75
hutech,hutech,100
trường cđ công nghệ thủ đức, cao dang  cong nghe thu duc,58
Đại học Ngân Hàng TPHCM,dai hoc ngan hang hcm,50
Trung cấp kỹ thuật Tây Nam Á,trung cap ky thuat tay nam a,71
Trường Đại học Công nghiệp Thực phẩm,dai hoc cong nghiep thuc pham,62
Học viện Báo chí và Tuyên truyền,hoc vien bao chi tuyen truyen,66
cao đẳng công nghiệp hưng yên,cao dang cong nghiep hung yen,79
TÔN ĐỨC THẮNG,ton duc thang,15
thpt go vap,thpt go vap,100
Trường đại học công nghiệp thực phẩm Tp. hcm,dai hoc cong nghiep thuc pham   hcm,68
Đại học Kinh tế TpHCm,dai hoc kinh te hcm,60
đại học nguyễn tất thành,dai hoc nguyen tat thanh,75
kinh Doanh Công Nghệ Hà Nội,kinh doanh cong nghe ha noi,67
trường cao đẳng nghề kỉ thuật công nghệ dung quất,cao dang nghe ki thuat cong nghe dung quat,75
cao dang kinh Te kỹ thuật Phú Lâm,cao dang kinh te ky thuat phu lam,79
trung cấp nghe yen bai,trung cap nghe yen bai,95
Đại Học Kinh Tế TPHCM,dai hoc kinh te hcm,45
cao đẳng sư phạm trung ương thành phố Hồ Chí Minh,cao dang su pham trung uong   hcm,61
University of Finance and Marketing,university of finance and marketing,91
di nong lam,di nong lam,100
FPT POLYTECHNIC,fpt polytechnic,7
học viện tài chính,hoc vien tai chinh,78
Đại học Thăng Long,dai hoc thang long,67
Trường cao đẳng kĩ thuật thành phố hồ chí minh,cao dang ki thuat   hcm,55
Đại học Hoa Sen,dai hoc hoa sen,67
University of Finance and Marketig,university of finance and marketig,91
ĐẠI HỌC KIẾN TRÚC ĐÀ NẴNG,dai hoc kien truc da nang,20
cao đẳng tài chính hải quan,cao dang tai chinh hai quan,81
cao đẳng dược hồng đức,cao dang duoc hong duc,68
học viện nông nghiệp việt nam,hoc vien nong nghiep viet nam,83
TTGDTX q9,trung tam giao duc thuong xuyen q9,14
