raw,new,score
Trung Cấp Miền Đông,trung cap mien dong,63
mạch kiếm hùng,mach kiem hung,79
Đại học Kinh tế Tp.Hồ Chí Minh,dai hoc kinh te  hcm,52
Đại học Lạc Hồng,dai hoc lac hong,56
Học viện nông nghiệp Việt Nam,hoc vien nong nghiep viet nam,72
Đại học Hà Nội,dai hoc ha noi,50
đh điện lực, dai hoc  dien luc,48
Đại Học Điện Lực,dai hoc dien luc,50
ĐH Kinh Doanh và Công Nghệ Hà Nội, dai hoc  kinh doanh cong nghe ha noi,51
Truong Dai Hoc Hang Hai Viet Nam,dai hoc hang hai viet nam,67
Cao đẳng Công nghệ Thủ Đức,cao dang cong nghe thu duc,62
Cao Đẳng Kinh Tế Đối Ngoại,cao dang kinh te doi ngoai,62
THPT Nguyễn Hiền,thpt nguyen hien,50
trung cấp nghề trần đại nghĩa,trung cap nghe tran dai nghia,79
Đại học Công nghiệp thực phẩm tphcm,dai hoc cong nghiep thuc pham hcm,74
Đại học Văn Hóa Hồ Chí Minh,dai hoc van hoa hcm,43
cao đẳng công nghệ đông á,cao dang cong nghe dong a,72
thcs lê minh xuân,thcs le minh xuan,88
THPT Lê Thánh Tôn,thpt le thanh ton,41
THPT TT Trương Vĩnh Ký,thpt tt truong vinh ky,48
Trường đào tạo kinh tế quốc doanh,dao tao kinh te quoc doanh,72
Đại Học Tôn Đức Thắng,dai hoc ton duc thang,52
Trường Đại Học kỹ thuật công nghiệp Thái Nguyên,dai hoc ky thuat cong nghiep thai nguyen,64
Guangxi University for Nationalities  - China,guangxi university for nationalities   china,90
trường cao đẳng kinh tế tphcm,cao dang kinh te hcm,69
Đại học Sư phạm Kĩ thuật Hưng Yên,dai hoc su pham ki thuat hung yen,61
cao đẳng tài chính quản trị kinh doanh,cao dang tai chinh quan tri kinh doanh,84
Cao đẳng Công nghệ thông tin TPHCM,cao dang cong nghe thong tin hcm,67
trường phổ thông trung học hồ thị kỷ,pho thong trung hoc ho thi ky,71
ĐH Nông Lâm TpHCM, dai hoc  nong lam hcm,31
Học Viện Hàng Không Việt Nam,hoc vien hang khong viet nam,61
thptnghison,thptnghison,100
Đại Học Công Nghệ Tp. Hồ Chí Minh,dai hoc cong nghe   hcm,46
Montpellier 3,monellier 3,83
dh su pham tphcm, dai hoc  su pham hcm,76
Đại học Quốc tế Hồng Bàng,dai hoc quoc te hong bang,60
Cao Đẳng Việt Mỹ,cao dang viet my,56
Đại học Luật Thành phố Hồ Chí Minh,dai hoc luat   hcm,42
Đại Học Ngoại Thương,dai hoc ngoai thuong,55
trường Cao dang nghe ky thuat công nghệ tp.HCM,cao dang nghe ky thuat cong nghe  hcm,72
Trường ĐH Quốc tế Hồng Bàng, dai hoc  quoc te hong bang,44
CD Nghề Kỹ Thuật Công nghệ Tp.Hcm, cao dang  nghe ky thuat cong nghe  hcm,50
Đại học ngoại ngữ huế,dai hoc ngoai ngu hue,71
Đại học công nghiệp 4,dai hoc cong nghiep 4,76
đại học công nghiệpbtp. hồ chí minh,dai hoc cong nghiepb  hcm,63
RMIT UNIVERSITY,rmit university,7
Đại Học Khoa học xã hội& Nhân văn,dai hoc khoa hoc xa hoi  nhan van,64
Linfield Christian high school (US),linfield christian high school ,88
cao đẳng kỹ thuật công nghệ Vạn XUân,cao dang ky thuat cong nghe van xuan,69
Đại học Hà Nội- Trung tâm ngoại ngữ  ABC,dai hoc ha noi  trung tam ngoai ngu abc,61
Trường trung cấp Công nghệ Hà Nội,trung cap cong nghe ha noi,61
Southern New Hamsphire University,southern new hamsphire university,88
Đại học Ngân Hàng TPHCM,dai hoc ngan hang hcm,50
DH KHXH&NV, dai hoc   khoa hoc xa hoi  nv,5
Thpt Nguyễn Trung Trực,thpt nguyen trung truc,73
lý tự trọng,ly tu trong,73
Đại học GTVT Hà Nội,dai hoc giao thong van tai ha noi,31
Đại học mỏ địa chất,dai hoc mo dia chat,63
cao đẳng gtvt miền trung,cao dang giao thong van tai mien trung,68
Đại học bách khoa thành phố Hồ Chí Minh,dai hoc bach khoa   hcm,55
Cao đẳng GTVT,cao dang giao thong van tai,30
Trung Cấp Kinh Tế Kỹ Thuật Phương Nam,trung cap kinh te ky thuat phuong nam,62
Đại học Văn Lang,dai hoc van lang,62
cao đẳng tài chính hải quan,cao dang tai chinh hai quan,81
Đại học Công Nghệ TP.HCM,dai hoc cong nghe  hcm,48
đại học Hàng Hải Việt Nam,dai hoc hang hai viet nam,60
Hutech,hutech,83
trường đại học bách khoa Tp HCM,dai hoc bach khoa  hcm,57
Trường Đại học Công nghiệp Tp. Hồ Chí Minh,dai hoc cong nghiep   hcm,51
Đại Học Công Đoàn,dai hoc cong doan,53
Đại học Luật tp hcm,dai hoc luat  hcm,67
Cao Đẳng Điện Lực TPHCM,cao dang dien luc hcm,50
Trường đại học Công nghiệp thực phẩm TP.HCM,dai hoc cong nghiep thuc pham  hcm,57
Ton Duc Thang University,ton duc thang university,83
cao đẳng cộng đồng hà nội,cao dang cong dong ha noi,72
Đại Học Công Nghiệp TP HCM,dai hoc cong nghiep  hcm,52
Đại Học Sài Gòn,dai hoc sai gon,47
THPT Nguyễn Thị Minh Khai,thpt nguyen thi minh khai,60
Đại học Tôn Đức Thắng,dai hoc ton duc thang,57
cao đằng giao thông vận tải,cao dang giao thong van tai,81
học viện nông nghiệp việt nam,hoc vien nong nghiep viet nam,83
Đại Học Sư Phạm Kỹ Thuật TP Hồ Chí Minh,dai hoc su pham ky thuat  hcm,44
đại học ky thuật kinh tế bình dương,dai hoc ky thuat kinh te binh duong,77
Truong Dai Hoc Cong Nghiep Tp.HCM,dai hoc cong nghiep  hcm,56
đại học hoa sen,dai hoc hoa sen,80
cao đẳng giao thông vận tải III,cao dang giao thong van tai  2 i,73
Đại học Khoa học xã hội và nhân văn,dai hoc khoa hoc xa hoi nhan van,69
Trường Đại Học Điều Dưỡng Nam Định,dai hoc dieu duong nam dinh,49
THPT ĐÀO DUY ANH,thpt dao duy anh,19
trương trung hoc pho thong Nguyễn hữu cảnh,trung hoc pho thong nguyen huu canh,81
thcs long điền đông b,thcs long dien dong b,81
Bolton university,bolton university,94
Đại học Lao động Xã hội,dai hoc lao dong xa hoi,61
đại học ngân hàng tphcm,dai hoc ngan hang hcm,73
Học viện Hành chính Quốc gia,hoc vien hanh chinh quoc gia,71
đại học kinh tế quốc dân,dai hoc kinh te quoc dan,75
đại học luật hà nội,dai hoc luat ha noi,68
Đại học Hoa Sen,dai hoc hoa sen,75
Viện Đại Học Mở Hà Nội,vien dai hoc mo ha noi,52
Viện đại học Mở Hà Nội,vien dai hoc mo ha noi,50
Học viện Hành Chính Quốc Gia ,hoc vien hanh chinh quoc gia,63
Đại Học Điện Lực ( hệ Cao Đẳng ) ,dai hoc dien luc ,36
Đại học y Hà Nội,dai hoc y ha noi,56
Cao Đẳng Viễn Đông,cao dang vien dong,61
THPT LONG XUYÊN,thpt long xuyen,13
đại học Kinh doanh và công nghệ Hà Nội,dai hoc kinh doanh cong nghe ha noi,68
"trung cấp kinh tế du lịch  Hoa Sữa """"","trung cap kinh te du lich hoa sua """"",82
Trường Đại Học Tài Chính Marketing,dai hoc tai chinh marketing,59
Trường THPT Phạm Thành Trung,thpt pham thanh trung,49
Trường Đại học Văn hoá - Nghệ thuật Quân đội,dai hoc van hoa   nghe thuat quan doi,57
Cao đẳng Kinh tế,cao dang kinh te,69
Cao đẳng Kinh tế,cao dang kinh te,69
FPT Arena Multimedia,fpt arena multimedia,75
đại học sư phạm hà nội,dai hoc su pham ha noi,68
học viện CSND,hoc vien canh sat nhan dan,36
bách khoa,bach khoa,89
Trung cap thu duc,trung cap thu duc,94
Đại học Bách Khoa TP. HCM,dai hoc bach khoa   hcm,54
Cao đẳng Kinh Tế Công Nghệ TP.HCM,cao dang kinh te cong nghe  hcm,53
trường năng khiếu thể dục thể thao thành phố,nang khieu the duc the thao  ,66
THPT Phú Nhuận ,thpt phu nhuan,41
trung học phổ thông chu văn an,trung hoc pho thong chu van an,87
Đại học Tôn Đức Thắng,dai hoc ton duc thang,57
ACCA,acca,0
ĐẠI HỌC KHOA HỌC THÁI NGUYÊN,dai hoc khoa hoc thai nguyen,18
Đại học Công Nghiệp Hà Nội,dai hoc cong nghiep ha noi,58
FPT-Aptech,fpt aptech,50
Đại học tổng hợp Hà Nội,dai hoc tong hop ha noi,61
Đại Học Thương Mại,dai hoc thuong mai,50
Giồng Ông Tố,giong ong to,58
Học viện Ngân hàng,hoc vien ngan hang,67
"Trường THCS & THPH Cấp ll, lll Hóa Tiến",thcs   thph cap ll  lll hoa tien,48
Đại Học Mở Thành Phố Hồ Chí Minh,dai hoc mo   hcm,33
đại học công nghệ tphcm,dai hoc cong nghe hcm,73
nguyen an ninh,nguyen an ninh,100
THPT TUY PHƯỚC,thpt tuy phuoc,14
hoc viện hàng không việt nam,hoc vien hang khong viet nam,86
THPT Nguyễn Gia Thiều,thpt nguyen gia thieu,57
Đại học ngoại ngữ- Đại học quốc gia Hà Nội,dai hoc ngoai ngu  dai hoc quoc gia ha noi,67
Đại học công nghệ sài gòn,dai hoc cong nghe sai gon,72
trung học phổ thông,trung hoc pho thong,84
Trung Cấp Kỹ Thuật Và Nghiệp Vụ Nam Sài Gòn,trung cap ky thuat nghiep vu nam sai gon,58
trường Cao đẳng tài chính- Hải quan,cao dang tai chinh  hai quan,63
Cao đẳng Công Thương TP. HCM,cao dang cong thuong   hcm,52
đại học điện lực,dai hoc dien luc,62
fpt university,fpt university,100
thpt bình minh,thpt binh minh,93
thpt bình minh,thpt binh minh,93
Đại học tài chính kế toán Tp.HCM,dai hoc tai chinh ke toan  hcm,61
ĐH Sư Phạm HN, dai hoc  su pham ha noi,27
truong cdxd so 2, cao dang xd so 2,67
 Trường Đại học Ngoại thương,dai hoc ngoai thuong,54
C Đ Kinh Tế Kĩ Thuật Cần Thơ,c d kinh te ki thuat can tho,54
Đại học Tôn Đức Thắng,dai hoc ton duc thang,57
ĐH Luật TP HCM, dai hoc  luat  hcm,30
ĐH Ngoại Thương, dai hoc  ngoai thuong,43
ĐH Kinh Tế TP.HCM, dai hoc  kinh te  hcm,30
 Học viện Tài Chính (Academy Of Finance),hoc vien tai chinh ,41
Hanoi Aptech - Trường đào tạo lập trình viên quốc tế,hanoi aptech   truong dao tao lap trinh vien quoc te,73
ĐH Giao Thông Vận Tải, dai hoc  giao thong van tai,49
 HCMUTE - SPKT,hcmute   spkt,22
Du Học Tại Chỗ - Liên Kết ĐH Sunderland UK & Đại Học Sư Phạm Kỹ Thuật TPHCM,du hoc tai cho   lien ket  dai hoc  sunderland uk   dai hoc su pham ky thuat hcm,52
trường trung cấp quân y 2,trung cap quan y 2,74
Đại học Công Đoàn,dai hoc cong doan,59
Foreign Trade Univesity,foreign trade univesity,87
 Trường Đại Học Công Nghiệp TP-HCM,dai hoc cong nghiep  hcm,41
ĐH Mở TPHCM, dai hoc  mo hcm,15
 Cao Đẳng Công Thương TP Hồ Chí Minh,cao dang cong thuong  hcm,49
học viện ngân hàng,hoc vien ngan hang,78
 Vietnam Commercial University,vietnam commercial university,88
Trường Đại học Mỏ - Địa chất,dai hoc mo   dia chat,49
ĐH sư phạm TP HCM, dai hoc  su pham  hcm,41
Trường Đại học Công nghiệp Thực Phẩm TPHCM,dai hoc cong nghiep thuc pham hcm,53
Hutech university,hutech university,94
đại học công nghệ,dai hoc cong nghe,71
Học viện Ngoại Giao,hoc vien ngoai giao,68
THPT Kim Liên,thpt kim lien,46
Thể Dục Thể Thao ,the duc the thao,55
ThCS Bình An,thcs binh an,50
Đại học Kinh tế Quốc dân,dai hoc kinh te quoc dan,69
Đại học Kiến Trúc Hà Nội,dai hoc kien truc ha noi,54
ĐH Hà Tĩnh, dai hoc  ha tinh,30
kinh tế kĩ thuật thái nguyên,kinh te ki thuat thai nguyen,82
học viện tài chính,hoc vien tai chinh,78
Đại Học Nguyễn Tất Thành,dai hoc nguyen tat thanh,58
Cao đẳng Thương Mại và Du Lịch,cao dang thuong mai du lich,56
FPT Polytechnic,fpt polytechnic,73
CDCD BINH THUAN, cao dang  cao dang  binh thuan,9
ĐH thuỷ sản nha trang, dai hoc  thuy san nha trang,69
Học viện Báo chí Tuyên truyền,hoc vien bao chi tuyen truyen,69
cao đẳng công thương,cao dang cong thuong,75
đại học đa nẵng,dai hoc da nang,67
Cao đẳng Kinh Kinh Tế Công Nghệ Tp.HCM,cao dang kinh kinh te cong nghe  hcm,57
Trường đào tạo lái xe thăng long,dao tao lai xe thang long,75
năng khiếu thể dục thể thao,nang khieu the duc the thao,81
Hutech University,hutech university,88
Đại Học Khoa Học Tự Nhiên,dai hoc khoa hoc tu nhien,56
ĐH Tôn Đức Thắng, dai hoc  ton duc thang,41
ĐH Tôn Đức Thắng, dai hoc  ton duc thang,41
Đại học thương Mại,dai hoc thuong mai,61
Đại Học Lạc Hồng,dai hoc lac hong,50
THPT Phan Huy Chú Đống Đa,thpt phan huy chu dong da,56
Cao Đẳng Nghề Bách Khoa Hà Nội,cao dang nghe bach khoa ha noi,60
Đại học Công Nghệ - Đại học Quốc gia,dai hoc cong nghe   dai hoc quoc gia,64
Duy Tan,duy tan,71
Kinh nghiệm tự tìm hiểu,kinh nghiem tu tim hieu,78
Đại học lao động xã hội,dai hoc lao dong xa hoi,70
Trường Cao Đẳng Điện Tử - Điện Lạnh Hà Nôi,cao dang dien tu   dien lanh ha noi,49
cao đẳng văn hóa nghệ thuật du lịch sài gòn,cao dang van hoa nghe thuat du lich sai gon,79
ngoại ngữ đông du,ngoai ngu dong du,76
hoa ngữ dân lập tân bảo,hoa ngu dan lap tan bao,78
Đại học Sư Phạm Hà Nội,dai hoc su pham ha noi,50
nguyễn tất thành,nguyen tat thanh,81
Trường Đại học Khoa học xã hội và nhân văn,dai hoc khoa hoc xa hoi nhan van,62
Đại học Cần Thơ,dai hoc can tho,53
Đại học Văn hóa Hà Nội,dai hoc van hoa ha noi,55
THPT Nguyễn Thái Bình,thpt nguyen thai binh,52
Saigontech Institude University,saigontech institude university,90
Đại học Đà Lạt,dai hoc da lat,50
Trường CĐ GTVT3, cao dang  giao thong van tai3,22
đại học sư phạm hà nội,dai hoc su pham ha noi,68
Trường THPT Đoàn kết ,thpt doan ket,35
đại học kinh doanh và công nghệ,dai hoc kinh doanh cong nghe,78
đại học thái nguyên,dai hoc thai nguyen,74
đại học giáo dục- đại học quốc gia hà nội,dai hoc giao duc  dai hoc quoc gia ha noi,71
Cao Đẳng Kinh Tế Kỹ Thuật TP. Hồ Chí Minh,cao dang kinh te ky thuat   hcm,53
Saigontourist Hospitality College,saigontourist hospitality college,91
Đại Học Lâm Nghiệp Việt Nam,dai hoc lam nghiep viet nam,59
Trường Cao Đẳng Nghề KTCN Việt Nam -Hàn Quốc,cao dang nghe ktcn viet nam  han quoc,48
Đại Học Thành Đô,dai hoc thanh do,50
Trường Đại học Kinh doanh và Công nghệ Hà Nội,dai hoc kinh doanh cong nghe ha noi,60
Đại Học La Trobe ,dai hoc la trobe,61
học viện công nghệ bưu chính viễn thông,hoc vien cong nghe buu chinh vien thong,79
Đại học Công Nghệ Hutech,dai hoc cong nghe hutech,67
trung cấp nghề số 18,trung cap nghe so 18,79
Troy University,troy university,87
đại học kinh tế,dai hoc kinh te,73
đại học sư phạm kĩ thuật tp HCM,dai hoc su pham ki thuat  hcm,63
anh van hoi viet my,anh van hoi viet my,100
đại học ngoại thương,dai hoc ngoai thuong,70
đại học giao thông vận tải,dai hoc giao thong van tai,77
công nghệ,cong nghe,78
Trung học phổ thông nguyễn trải,trung hoc pho thong nguyen trai,81
Trung học phổ thông nguyễn trải,trung hoc pho thong nguyen trai,81
Đại học Lạc Hồng,dai hoc lac hong,56
Đại học Thăng Long,dai hoc thang long,67
Học viện nông nghiệp Việt Nam,hoc vien nong nghiep viet nam,72
Học viện ngân hàng,hoc vien ngan hang,72
truong thcs xuan thoi thuong,thcs xuan thoi thuong,86
 Dai hoc nguyen tat thanh,dai hoc nguyen tat thanh,94
Đại học kinh tế - Đại học Huế,dai hoc kinh te   dai hoc hue,66
 Đại học Kinh tế và quản trị kinh doanh Thái Nguyên,dai hoc kinh te quan tri kinh doanh thai nguyen,73
Cao đẳng Bách Khoa,cao dang bach khoa,67
Amity international school,amity international school,96
Trường trung học Colette,trung hoc colette,73
Đại học Bình Dương,dai hoc binh duong,56
Trường Đại Học Kinh Tế Quốc Dân,dai hoc kinh te quoc dan,47
trường ĐH Công Nghiệp TP.HCM, dai hoc  cong nghiep  hcm,37
Trường Đại học Kinh Tế Quốc Dân,dai hoc kinh te quoc dan,51
Trường Đại Học Sư Phạm Hà Nội,dai hoc su pham ha noi,39
CĐ thực hành fpt  polytechnic, cao dang  thuc hanh fpt polytechnic,74
Hanoi University of Science and Technology,hanoi university of science and technology,90
Trường Đại Học Khoa Học Tự Nhiên,dai hoc khoa hoc tu nhien,49
Trường Đại Học Khoa Học Tự Nhiên,dai hoc khoa hoc tu nhien,49
DpiCENTER,dpicenter,22
Đại học Mở TPHCM,dai hoc mo hcm,40
học viện bưu chính viễn thông,hoc vien buu chinh vien thong,79
Đại học Sư phạm TP Hồ Chí Minh,dai hoc su pham  hcm,48
Đại học Kinh tế Quốc dân,dai hoc kinh te quoc dan,67
Đại học Kinh tế Quốc dân,dai hoc kinh te quoc dan,67
Đại học Giao thông vận tải TpHCM,dai hoc giao thong van tai hcm,65
Trường Đại học Công nghệ Thông tin - Đại học Quốc gia TP.HCM,dai hoc cong nghe thong tin   dai hoc quoc gia  hcm,59
trường trung học cơ sở tuy hòa,trung hoc co so tuy hoa,74
IUH - ĐH Công Nghiệp TP.HCM,iuh    dai hoc  cong nghiep  hcm,37
HUTECH - Trường Đại học Công nghệ TP.HCM,hutech   truong dai hoc cong nghe  hcm,46
ĐH FPT, dai hoc  fpt,11
Dai Hoc Hai Phong Haiphong,dai hoc hai phong haiphong,81
Đại học Sài Gòn,dai hoc sai gon,53
Đại Học Khoa Học Tự Nhiên - ĐHQG Hà Nội ,dai hoc khoa hoc tu nhien    dai hoc  quoc gia  ha noi,43
Đại học Khoa học Xã hội và Nhân văn TP Hồ Chí Minh,dai hoc khoa hoc xa hoi nhan van  hcm,55
Đại học Công nghệ - Đại học Quốc gia Hà Nội,dai hoc cong nghe   dai hoc quoc gia ha noi,63
Đại học Công nghệ - Đại học Quốc gia Hà Nội,dai hoc cong nghe   dai hoc quoc gia ha noi,63
Trường Viện Đại học Mở Hà Nội,vien dai hoc mo ha noi,43
ĐH Hà Nội, dai hoc  ha noi,24
Đại Học Y Hà Nội Hà Nội,dai hoc y ha noi ha noi,43
Đại học kinh doanh công nghệ Hà Nội,dai hoc kinh doanh cong nghe ha noi,74
ĐH Thương Mại, dai hoc  thuong mai,36
Hanoi College of Education,hanoi college of education,88
ĐH Mở HN, dai hoc  mo ha noi,15
Ho Chi Minh City University of Technology,hcm city university of technology,76
Đại học Hà Nội ,dai hoc ha noi,48
Học viện Báo chí và Tuyên truyền ,hoc vien bao chi tuyen truyen,65
dh khoa hoc tu nhien, dai hoc  khoa hoc tu nhien,85
Học viện tài chính,hoc vien tai chinh,72
đại học giao thông vận tải,dai hoc giao thong van tai,77
Đại học Giao thông vận tải,dai hoc giao thong van tai,73
ĐH Công Đoàn, dai hoc  cong doan,39
trường chuyên Hưng Yên,chuyen hung yen,53
Học Viện Ngân Hàng,hoc vien ngan hang,56
Khoa Quốc tế - Đại học Quốc gia Hà Nội,khoa quoc te   dai hoc quoc gia ha noi,63
Đại học Khoa học xã hội và nhân văn,dai hoc khoa hoc xa hoi nhan van,69
Đại học Nông Lâm Tp.HCM,dai hoc nong lam  hcm,45
học viện tài chính,hoc vien tai chinh,78
cao đẵng công nghệ thủ đức,cao dang cong nghe thu duc,73
Đại Học Lạc Hồng,dai hoc lac hong,50
cao đẳng xây dựng 1,cao dang xay dung 1,79
Trường Trung Tâm Giáo Dục Thường Xuyên Cam Lâm,trung tam giao duc thuong xuyen cam lam,56
đại học ngân hàng tp.hcm,dai hoc ngan hang  hcm,70
trường cao đẳng xây dựng,cao dang xay dung,63
Deakin University ,deakin university,86
ĐH Ngoại thương, dai hoc  ngoai thuong,49
thpt,thpt,100
trường thpt trung văn,thpt trung van,74
Đại học Nông lâm TPHCM,dai hoc nong lam hcm,52
Đại học Ngoại ngữ - Đại học Quốc gia Hà Nội,dai hoc ngoai ngu   dai hoc quoc gia ha noi,69
Đại học Tôn Đức Thắng,dai hoc ton duc thang,57
trung cấp nghề văn lang,trung cap nghe van lang,87
Học viện Nông nghiệp Việt Nam,hoc vien nong nghiep viet nam,69
Đại học Kinh tế quốc dân,dai hoc kinh te quoc dan,71
trung cấp dược Hà Nội,trung cap duoc ha noi,67
trung cấp dược Hà Nội,trung cap duoc ha noi,67
Đại học GTVT,dai hoc giao thong van tai,26
Đại học Sài Gòn,dai hoc sai gon,71
Trung cấp Kinh tế kĩ thuật nghiệp vụ Nguyễn Hữu Cảnh,trung cap kinh te ki thuat nghiep vu nguyen huu canh,73
DPI center,dpi center,70
công ty Digital Work,cong ty digital work,85
Đại Học Kiến Trúc Tp.Hồ Chí Minh,dai hoc kien truc  hcm,44
Đại Học Kinh Tế Tài Chính,dai hoc kinh te tai chinh,56
Trung Học Thực Hành - Đại Học Sư Phạm,trung hoc thuc hanh   dai hoc su pham,57
ĐH Luật TP.HCM, dai hoc  luat  hcm,24
Đại Học Công Nghệ TPHCM,dai hoc cong nghe hcm,45
đai hoc đại nam,dai hoc dai nam,80
dai hoc cong nghiep tphcm,dai hoc cong nghiep hcm,96
trung cấp,trung cap,89
Cao Đẵng Nghề Sô 8,cao dang nghe so 8,61
Cao đẳng Nghề Long Biên,cao dang nghe long bien,65
Đại học công nghệ thông tin Gia Định,dai hoc cong nghe thong tin gia dinh,75
Trường đại học ngoại ngữ và tin học thành phố Hồ Chí Minh,dai hoc ngoai ngu tin hoc   hcm,52
Đại học Kinh tế Luật TPHCM,dai hoc kinh te luat hcm,59
Trương cao đẳng y tế Bạc Liêu,cao dang y te bac lieu,59
đại học sư pham tp. Hồ Chí Minh,dai hoc su pham   hcm,58
trường pt đông kinh,pt dong kinh,65
Trường đại học GTVT tp Hồ Chí Minh,dai hoc giao thong van tai  hcm,34
Học Viện công nghệ Bưu Chính Viễn Thông cơ sở tại TPHCM,hoc vien cong nghe buu chinh vien thong co so tai hcm,61
Học viện Ngoại giao,hoc vien ngoai giao,74
Dh sai gon, dai hoc  sai gon,67
south China University of technology,south china university of technology,94
Đại học Đông Đô,dai hoc dong do,53
CAO ĐẲNG CÔNG NGHỆ THỦ ĐỨC,cao dang cong nghe thu duc,19
THPT Hương Cần,thpt huong can,36
The University of Kansas,the university of kansas,88
"đại học Khoa học Xã hội và Nhân văn, Hà Nội",dai hoc khoa hoc xa hoi nhan van  ha noi,58
 Hanoi university of Business and Technology (HUBT),hanoi university of business and technology ,86
Đại Học Mỏ Địa Chất Hà Nội,dai hoc mo dia chat ha noi,46
Đại học Shute Đài Loan,dai hoc shute dai loan,68
Saigon College of Art Culture and Tourism (SAIGONACT),saigon college of art culture and tourism ,78
Đại học ngoại ngữ Đà Nẵng,dai hoc ngoai ngu da nang,64
Université Laval,universite laval,81
Đại học Công Nghiệp TpHCM,dai hoc cong nghiep hcm,54
ĐH Quy Nhơn, dai hoc  quy nhon,41
Khoa Luật - ĐHQG HN,khoa luat    dai hoc  quoc gia  ha noi,32
Cao đẳng Công nghiệp Phúc Yên,cao dang cong nghiep phuc yen,66
ĐH Bách Khoa TP HCM, dai hoc  bach khoa  hcm,42
Đại học Mở TP HCM,dai hoc mo  hcm,44
ĐH Bách Khoa TP HCM, dai hoc  bach khoa  hcm,42
Cao đẳng kỹ thuật Lý Tự Trọng,cao dang ky thuat ly tu trong,62
Đại học Giao thông vận tải TpHCM,dai hoc giao thong van tai hcm,65
ĐH KTQD, dai hoc  ktqd,10
CD phát thanh truyền hình, cao dang  phat thanh truyen hinh,69
DLU - Sinh Viên Đại Học Đà Lạt,dlu   sinh vien dai hoc da lat,50
Trường Đại học Luật TP.HCM,dai hoc luat  hcm,37
Kent International College,kent international college,88
Cao đẳng kinh tế kỹ thuật thương mại,cao dang kinh te ky thuat thuong mai,75
Cao Đẳng Kinh Tế - Công Nghệ TpHCM,cao dang kinh te   cong nghe hcm,55
Cao Đẳng Kinh Tế Công NGhiệp Hà Nội,cao dang kinh te cong nghiep ha noi,57
Đại học sư phạm kỹ thuật Hưng Yên,dai hoc su pham ky thuat hung yen,67
Đại học Mở Tp.HCM,dai hoc mo  hcm,38
Cao Đẳng Dược TW Hải Dương,cao dang duoc tw hai duong,50
Cao đẳng Sư Phạm Trung Ương TP.HCM,cao dang su pham trung uong  hcm,55
đh Hà Nội, dai hoc  ha noi,32
đại học quốc tế Hồng Bàng,dai hoc quoc te hong bang,64
Đại học Thái Nguyên,dai hoc thai nguyen,63
học viện công nghệ bưu chính viễn thông,hoc vien cong nghe buu chinh vien thong,79
Trường Đại học Sài Gòn,dai hoc sai gon,43
Cao đẳng thương mại và du lịch Hà Nội,cao dang thuong mai du lich ha noi,65
Hoa Sen,hoa sen,71
University of Warsaw,university of warsaw,90
Troy University,troy university,87
CĐ  VHNT&DL Sài gòn, cao dang  vhnt dl sai gon,31
Cao đẳng giao thông vận tải,cao dang giao thong van tai,78
Đại học Tôn Dức Thắng,dai hoc ton duc thang,57
cao đẳng kinh tế Tp.HCM,cao dang kinh te  hcm,64
Đại Học Kinh Tế TPHCM,dai hoc kinh te hcm,45
Á Âu Vocational School,a au vocational school,82
CDSP Hưng Yên, cao dang su pham hung yen,26
cao dăng hai duong,cao dang hai duong,94
thpt thủ đức,thpt thu duc,75
Đại Học Điện Lực Hệ Trung cấp,dai hoc dien luc he trung cap,59
Học viện kỹ thuật quân  sự,hoc vien ky thuat quan su,71
đại học thành đô,dai hoc thanh do,62
đại học bách khoa hà nội,dai hoc bach khoa ha noi,75
đại học công nghiệp tphcm ,dai hoc cong nghiep hcm,73
Đại học khoa học tự nhiên hà nội,dai hoc khoa hoc tu nhien ha noi,75
đại học kinh tế kĩ thuật công nghiệp,dai hoc kinh te ki thuat cong nghiep,78
TRƯỜNG CAO ĐẲNG VIỄN ĐÔNG,cao dang vien dong,14
cao đẳng Thương Mại và Du Lịch Hà Nội,cao dang thuong mai du lich ha noi,56
đại học sư phạm đà nẵng,dai hoc su pham da nang,65
trung cấp y khoa hà nội,trung cap y khoa ha noi,87
Đại học cần thơ,dai hoc can tho,67
Cao Đẳng Y Tế Đồng Nai,cao dang y te dong nai,59
THPT Trung Văn,thpt trung van,50
Đại Học Hoa Sen,dai hoc hoa sen,60
THPT Mộc LỴ,thpt moc ly,27
Đại học Công Nghệ Việt Hung,dai hoc cong nghe viet hung,63
